333,raiaan_review_2024,article,"Raiaan, Mohaimenul Azam Khan and Mukta, Md Saddam Hossain and Fatema, Kaniz and Fahad, Nur Mohammad and Sakib, Sadman and Mim, Most Marufatul Jannat and Ahmad, Jubaer and Ali, Mohammed Eunus and Azam, Sami",1.0,0.0,,,,,2169-3536,IEEE Access,Publisher: IEEE,,,,,"A review on large {Language} {Models}: {Architectures}, applications, taxonomies, open issues and challenges",,,2024.0,[Review],,,,,,,,,,,,,,,,,,,,,,,,,,,,,,,,,,,,,,,,,,,,,,,,,,,,,,,,,,,,,,,,,,,,,,,,,,,,,,,,,,,,,,,,,,,,,,,,,,,,,,,,,,,,,,,,,,,,,,,,,,,
334,raiskin_categorization_2019,article,"Raiskin, Y. and Eickhoff, C. and Beeler, P.E.",0.0,1.0,,,10.1016/j.ijmedinf.2019.05.020,,,International Journal of Medical Informatics,,,20--28,,,Categorization of free-text drug orders using character-level recurrent neural networks,https://www.scopus.com/inward/record.uri?eid=2-s2.0-85066256239&doi=10.1016%2fj.ijmedinf.2019.05.020&partnerID=40&md5=aadd2834360f0b365c336cb729499a20,129,2019.0,O,,,,,,,,,,,,,,,,,,,,,,,,,,,,,,,,,,,,,,,,,,,,,,,,,,,,,,,,,,,,,,,,,,,,,,,,,,,,,,,,,,,,,,,,,,,,,,,,,,,,,,,,,,,,,,,,,,,,,,,,,,,
335,rajashekar_human-algorithmic_2024,inproceedings,"Rajashekar, N.C. and Shin, Y.E. and Pu, Y. and Chung, S. and You, K. and Giuffre, M. and Chan, C.E. and Saarinen, T. and Hsiao, A. and Sekhon, J. and Wong, A.H. and Evans, L.V. and Kizilcec, R.F. and Laine, L. and McCall, T. and Shung, D.",0.0,1.0,,,10.1145/3613904.3642024,,,,,,,,,Human-{Algorithmic} {Interaction} {Using} a {Large} {Language} {Model}-{Augmented} {Artificial} {Intelligence} {Clinical} {Decision} {Support} {System},https://www.scopus.com/inward/record.uri?eid=2-s2.0-85194877819&doi=10.1145%2f3613904.3642024&partnerID=40&md5=db6c7d5e4f61bca623e8ee38e06c23bf,,2024.0,[No PET],,,,,,,,,,,,,,,,,,,,,,,,,,,,,,,,,,,,,,,,,,,,,,,,,,,,,,,,,,,,,,,,,,,,,,,,,,,,,,,,,,,,,,,,,,,,,,,,,,,,,,,,,,,,,,,,,,,,,,,,,,,
336,rajeshkumar_efficient_2024,article,"Rajeshkumar, K. and Dhanasekaran, S. and Vasudevan, V.",0.0,1.0,,,10.1007/s11042-023-17381-8,,,Multimedia Tools and Applications,,16,47111--47138,,,Efficient and secure medical big data management system using optimal map-reduce framework and deep learning,https://www.scopus.com/inward/record.uri?eid=2-s2.0-85174835358&doi=10.1007%2fs11042-023-17381-8&partnerID=40&md5=b30c949a7bddc120a933fbeace8b506b,83,2024.0,[No PET],,,,,,,,,,,,,,,,,,,,,,,,,,,,,,,,,,,,,,,,,,,,,,,,,,,,,,,,,,,,,,,,,,,,,,,,,,,,,,,,,,,,,,,,,,,,,,,,,,,,,,,,,,,,,,,,,,,,,,,,,,,
337,ramsdale_introduction_2021,article,"Ramsdale, E. and Snyder, E. and Culakova, E. and Xu, H. and Dziorny, A. and Yang, S. and Zand, M. and Anand, A.",0.0,1.0,,,10.1016/j.jgo.2021.03.012,,,Journal of Geriatric Oncology,,8,1159--1163,,,An introduction to machine learning for clinicians: {How} can machine learning augment knowledge in geriatric oncology?,https://www.scopus.com/inward/record.uri?eid=2-s2.0-85103392183&doi=10.1016%2fj.jgo.2021.03.012&partnerID=40&md5=bb5019799c8447a6c1ce86b8d45e80e0,12,2021.0,O,,,,,,,,,,,,,,,,,,,,,,,,,,,,,,,,,,,,,,,,,,,,,,,,,,,,,,,,,,,,,,,,,,,,,,,,,,,,,,,,,,,,,,,,,,,,,,,,,,,,,,,,,,,,,,,,,,,,,,,,,,,
338,rao_targeted-behrt_2024,article,"Rao, S. and Mamouei, M. and Salimi-Khorshidi, G. and Li, Y. and Ramakrishnan, R. and Hassaine, A. and Canoy, D. and Rahimi, K.",0.0,1.0,,,10.1109/TNNLS.2022.3183864,,,IEEE Transactions on Neural Networks and Learning Systems,,4,5027--5038,,,Targeted-{BEHRT}: {Deep} {Learning} for {Observational} {Causal} {Inference} on {Longitudinal} {Electronic} {Health} {Records},https://www.scopus.com/inward/record.uri?eid=2-s2.0-85133757812&doi=10.1109%2fTNNLS.2022.3183864&partnerID=40&md5=15dfc2783616899114317801336bae4c,35,2024.0,O,,,,,,,,,,,,,,,,,,,,,,,,,,,,,,,,,,,,,,,,,,,,,,,,,,,,,,,,,,,,,,,,,,,,,,,,,,,,,,,,,,,,,,,,,,,,,,,,,,,,,,,,,,,,,,,,,,,,,,,,,,,
339,raparthi_biomedical_2023,article,"Raparthi, M. and Dodda, S.B. and Maruthi, S.",0.0,1.0,,,10.52783/dxjb.v35.114,,,Dandao Xuebao/Journal of Ballistics,,1,52--61,,,Biomedical {Text} {Mining} for {Drug} {Discovery} using {Natural} {Language} {Processing} and {Deep} {Learning}.,https://www.scopus.com/inward/record.uri?eid=2-s2.0-85185814608&doi=10.52783%2fdxjb.v35.114&partnerID=40&md5=969e2ec8a1af8abdad1046837e362648,35,2023.0,O,,,,,,,,,,,,,,,,,,,,,,,,,,,,,,,,,,,,,,,,,,,,,,,,,,,,,,,,,,,,,,,,,,,,,,,,,,,,,,,,,,,,,,,,,,,,,,,,,,,,,,,,,,,,,,,,,,,,,,,,,,,
340,rasmy_training_2023,inproceedings,"Rasmy, L. and Xie, Z. and Zhi, D.",0.0,1.0,,,10.1109/ICHI57859.2023.00094,,,,,,529--530,,,Training {Recurrent} {Neural} {Network}-{Based} {Model} to {Predict} {COVID}-19 {Patient} {Risk} for {PASC} using {Pytorch}-{EHR} - {Hands}-on {Tutorial} on {N3C},https://www.scopus.com/inward/record.uri?eid=2-s2.0-85181559211&doi=10.1109%2fICHI57859.2023.00094&partnerID=40&md5=c4b62d415075b1b8806e1cab221e63df,,2023.0,O,,,,,,,,,,,,,,,,,,,,,,,,,,,,,,,,,,,,,,,,,,,,,,,,,,,,,,,,,,,,,,,,,,,,,,,,,,,,,,,,,,,,,,,,,,,,,,,,,,,,,,,,,,,,,,,,,,,,,,,,,,,
341,razmi_ai_2024,book,"Razmi, Ronald M",1.0,0.0,,,,1-394-24016-3,,,,,,John Wiley \& Sons,,"{AI} {Doctor}: {The} {Rise} of {Artificial} {Intelligence} in {Healthcare}-{A} {Guide} for {Users}, {Buyers}, {Builders}, and {Investors}",,,2024.0,[Review],,,,,,,,,,,,,,,,,,,,,,,,,,,,,,,,,,,,,,,,,,,,,,,,,,,,,,,,,,,,,,,,,,,,,,,,,,,,,,,,,,,,,,,,,,,,,,,,,,,,,,,,,,,,,,,,,,,,,,,,,,,
342,rebane_exploiting_2020,article,"Rebane, J. and Samsten, I. and Papapetrou, P.",0.0,1.0,,,10.1016/j.artmed.2020.101942,,,Artificial Intelligence in Medicine,,,,,,Exploiting complex medical data with interpretable deep learning for adverse drug event prediction,https://www.scopus.com/inward/record.uri?eid=2-s2.0-85091563501&doi=10.1016%2fj.artmed.2020.101942&partnerID=40&md5=05d5c48d21546897f21c2b6b551d6521,109,2020.0,O,,,,,,,,,,,,,,,,,,,,,,,,,,,,,,,,,,,,,,,,,,,,,,,,,,,,,,,,,,,,,,,,,,,,,,,,,,,,,,,,,,,,,,,,,,,,,,,,,,,,,,,,,,,,,,,,,,,,,,,,,,,
343,reddy_translational_2023,book,"Reddy, Sandeep",1.0,0.0,,,,1-00-381620-7,,,,,,CRC Press,,Translational {Application} of {Artificial} {Intelligence} in {Healthcare}:-{A} {Textbook},,,2023.0,[book],,,,,,,,,,,,,,,,,,,,,,,,,,,,,,,,,,,,,,,,,,,,,,,,,,,,,,,,,,,,,,,,,,,,,,,,,,,,,,,,,,,,,,,,,,,,,,,,,,,,,,,,,,,,,,,,,,,,,,,,,,,
344,rehman_fedcscd-gan:_2024,,,,,,,,,,,,,,,,,,,,,,,,,,,,,,,,,,,,,69.0,Rehman A.; Xing H.; Feng L.; Hussain M.; Gulzar N.; Adnan Khan M.; Hussain A.; Saeed D.,"Rehman, Amir (57223107748); Xing, Huanlai (25923226000); Feng, Li (57695543700); Hussain, Mehboob (57208385088); Gulzar, Nighat (58099202800); Adnan Khan, Muhammad (57576350200); Hussain, Abid (59000868600); Saeed, Dhekra (57216416962)",57223107748; 25923226000; 57695543700; 57208385088; 58099202800; 57576350200; 59000868600; 57216416962,FedCSCD-GAN: A secure and collaborative framework for clinical cancer diagnosis via optimized federated learning and GAN,2024.0,Biomedical Signal Processing and Control,89,,105893.0,,,,1.0,10.1016/j.bspc.2023.105893,https://www.scopus.com/inward/record.uri?eid=2-s2.0-85181701119&doi=10.1016%2fj.bspc.2023.105893&partnerID=40&md5=3c99b38dcc30374c37e8293ba8c94cff,Article,Final,,Scopus,2-s2.0-85181701119,0,Clinical Cancer Diagnosis,Privacy Evaluation,,1.0,0.0,1,0,0.0,0.0,0.0,0.0,0.0,0.0,0.0,0.0,0.0,0.0,0.0,Federated Learning,Differential Privacy,DP-CL,,,Tabular,"Kaggle, UCI ML repo, ","GAN, ",0.0,0.0,1.0,0.0,0.0,0.0,0.0,0.0,0.0,,,0.0,0.0,0.0,0.0,1.0,0.0,0.0,1.0,0.0,1.0,1.0,0.0,0.0,0.0,0.0,0.0,0.0,0.0,0.0,0.0,0.0,0.0,0.0,0.0,0.0,0.0,0.0,1.0,0.0,0.0,0.0,0.0,0.0,0.0,0.0,0.0,0.0,0.0,0.0,0.0,0.0,Oncology,1,yes,,,,ttps://github. com/arishamir/FedCSCD-GAN
345,rehman_fedcscd-gan_2024,article,"Rehman, A. and Xing, H. and Feng, L. and Hussain, M. and Gulzar, N. and Adnan Khan, M. and Hussain, A. and Saeed, D.",0.0,1.0,,,10.1016/j.bspc.2023.105893,,,Biomedical Signal Processing and Control,,,,,,{FedCSCD}-{GAN}: {A} secure and collaborative framework for clinical cancer diagnosis via optimized federated learning and {GAN},https://www.scopus.com/inward/record.uri?eid=2-s2.0-85181701119&doi=10.1016%2fj.bspc.2023.105893&partnerID=40&md5=3c99b38dcc30374c37e8293ba8c94cff,89,2024.0,DP-CL,1.0,0.0,0.0,,,,,,,,,,,,,,,,,,,,,,,,,,,,,,,,,,,,,,,,,,,,,,,,,,,,,,,,,,,,,,,,,,,,,,,,,,,,,,,,,,,,,,,,,,,,,,,,,,,,,,,,,,,,,,,,,,,,,,,,
346,reichenpfader_large_2023,article,"Reichenpfader, D. and Müller, H. and Denecke, K.",0.0,1.0,,,10.1136/bmjopen-2023-076865,,,BMJ Open,,12,,,,Large language model-based information extraction from free-text radiology reports: a scoping review protocol,https://www.scopus.com/inward/record.uri?eid=2-s2.0-85179647032&doi=10.1136%2fbmjopen-2023-076865&partnerID=40&md5=381abb7143b61074e332975b9b152099,13,2023.0,O,,,,,,,,,,,,,,,,,,,,,,,,,,,,,,,,,,,,,,,,,,,,,,,,,,,,,,,,,,,,,,,,,,,,,,,,,,,,,,,,,,,,,,,,,,,,,,,,,,,,,,,,,,,,,,,,,,,,,,,,,,,
347,rekabdar_machine_2022,article,"Rekabdar, B. and Albright, D. and McDaniel, J.T. and Talafha, S. and Jeong, H.",0.0,1.0,,,10.1016/j.health.2022.100104,,,Healthcare Analytics,,,,,,From machine learning to deep learning: {A} comprehensive study of alcohol and drug use disorder,https://www.scopus.com/inward/record.uri?eid=2-s2.0-85148478764&doi=10.1016%2fj.health.2022.100104&partnerID=40&md5=3288b36b782c62f8af4123de36fd7ca4,2,2022.0,O,,,,,,,,,,,,,,,,,,,,,,,,,,,,,,,,,,,,,,,,,,,,,,,,,,,,,,,,,,,,,,,,,,,,,,,,,,,,,,,,,,,,,,,,,,,,,,,,,,,,,,,,,,,,,,,,,,,,,,,,,,,
348,remadi_prompt_2024,article,"Remadi, Adel and El Hage, Karim and Hobeika, Yasmina and Bugiotti, Francesca",1.0,0.0,,,,,0169-023X,Data \& Knowledge Engineering,Publisher: Elsevier,,102313,,,To prompt or not to prompt: {Navigating} the use of large language models for integrating and modeling heterogeneous data,,152,2024.0,[No PET],,,,,,,,,,,,,,,,,,,,,,,,,,,,,,,,,,,,,,,,,,,,,,,,,,,,,,,,,,,,,,,,,,,,,,,,,,,,,,,,,,,,,,,,,,,,,,,,,,,,,,,,,,,,,,,,,,,,,,,,,,,
349,ren_generative_2022,inproceedings,"Ren, H. and Wang, J. and Zhao, W.X.",0.0,1.0,,,10.1145/3534678.3539020,,,,,,3810--3818,,,Generative {Adversarial} {Networks} {Enhanced} {Pre}-training for {Insufficient} {Electronic} {Health} {Records} {Modeling},https://www.scopus.com/inward/record.uri?eid=2-s2.0-85137147308&doi=10.1145%2f3534678.3539020&partnerID=40&md5=ee387b3c6b85391e67a4ce735cb491e7,,2022.0,SD,1.0,0.0,0.0,,,,,,,,,,,,,,182.0,Ren H.; Wang J.; Zhao W.X.,"Ren, Houxing (57224629562); Wang, Jingyuan (36111994400); Zhao, Wayne Xin (36769862300)",57224629562; 36111994400; 36769862300,Generative Adversarial Networks Enhanced Pre-training for Insufficient Electronic Health Records Modeling,2022.0,Proceedings of the ACM SIGKDD International Conference on Knowledge Discovery and Data Mining,,,,3810.0,3818.0,8.0,7.0,10.1145/3534678.3539020,https://www.scopus.com/inward/record.uri?eid=2-s2.0-85137147308&doi=10.1145%2f3534678.3539020&partnerID=40&md5=ee387b3c6b85391e67a4ce735cb491e7,Conference paper,Final,,Scopus,2-s2.0-85137147308,SD,Synthetic EHR Generation,"MLM Pretraining, real-fake contrastive classifier","Disease Predicition: Diabetes, Hypertension, Mortality",1.0,1.0,1,0,0.0,0.0,0.0,0.0,0.0,0.0,0.0,0.0,0.0,0.0,1.0,Synthetic Data,,SD,,,Tabular,"Barnes-Jewish Hospital from a large academic medical center, Washington University in St Louis, MIMIC",GAN-based,0.0,0.0,1.0,0.0,0.0,0.0,0.0,0.0,0.0,"F1, AUCROC, AUCPR",,1.0,1.0,0.0,0.0,1.0,1.0,0.0,0.0,1.0,0.0,0.0,0.0,0.0,0.0,0.0,0.0,0.0,0.0,0.0,0.0,0.0,0.0,0.0,0.0,0.0,0.0,0.0,0.0,0.0,0.0,0.0,0.0,0.0,0.0,0.0,0.0,0.0,0.0,0.0,0.0,0.0,General,-,-,,"The proposed method can generate high-quality augment data to solve the data insufficiency problem of EHR, and can also avoid introducing noises of fake data into the final prediction model. Extensive experiments on three healthcare-related real-world datasets demonstrated the effectiveness of our method. We also deployed our method in a maternal and child health care hospital for the online test, which further evaluated the performance of the proposed method.",item-relation aware GAN,
350,riviere_proceedings_2024,inproceedings,"Rivière, J.G. and Soler Palacín, P. and Butte, M.J.",0.0,1.0,,,10.1016/j.jaci.2024.01.002,,,,Issue: 3,,637--642,,,Proceedings from the inaugural {Artificial} {Intelligence} in {Primary} {Immune} {Deficiencies} ({AIPID}) conference,https://www.scopus.com/inward/record.uri?eid=2-s2.0-85185775549&doi=10.1016%2fj.jaci.2024.01.002&partnerID=40&md5=13a550434e9ffeb43c812886277ca12e,153,2024.0,O,,,,,,,,,,,,,,,,,,,,,,,,,,,,,,,,,,,,,,,,,,,,,,,,,,,,,,,,,,,,,,,,,,,,,,,,,,,,,,,,,,,,,,,,,,,,,,,,,,,,,,,,,,,,,,,,,,,,,,,,,,,
351,rodriguez-diaz_real-time_2021,inproceedings,"Rodriguez-Diaz, E. and Baffy, G. and Lo, W.-K. and Mashimo, H. and Vidyarthi, G. and Mohapatra, S.S. and Singh, S.K.",0.0,1.0,,,10.1016/j.gie.2020.09.018,,,,Issue: 3,,662--670,,,Real-time artificial intelligence–based histologic classification of colorectal polyps with augmented visualization,https://www.scopus.com/inward/record.uri?eid=2-s2.0-85096436185&doi=10.1016%2fj.gie.2020.09.018&partnerID=40&md5=66a021f92136cf074cc3b411fa817143,93,2021.0,O,,,,,,,,,,,,,,,,,,,,,,,,,,,,,,,,,,,,,,,,,,,,,,,,,,,,,,,,,,,,,,,,,,,,,,,,,,,,,,,,,,,,,,,,,,,,,,,,,,,,,,,,,,,,,,,,,,,,,,,,,,,
352,rouzrokh_mitigating_2022,article,"Rouzrokh, P. and Khosravi, B. and Faghani, S. and Moassefi, M. and Garcia, D.V.V. and Singh, Y. and Zhang, K. and Conte, G.M. and Erickson, B.J.",0.0,1.0,,,10.1148/ryai.210290,,,Radiology: Artificial Intelligence,,5,,,,Mitigating {Bias} in {Radiology} {Machine} {Learning}: 1. {Data} {Handling},https://www.scopus.com/inward/record.uri?eid=2-s2.0-85139164638&doi=10.1148%2fryai.210290&partnerID=40&md5=8c56534ac9f13ea5eb9431a1fdb48265,4,2022.0,O,,,,,,,,,,,,,,,,,,,,,,,,,,,,,,,,,,,,,,,,,,,,,,,,,,,,,,,,,,,,,,,,,,,,,,,,,,,,,,,,,,,,,,,,,,,,,,,,,,,,,,,,,,,,,,,,,,,,,,,,,,,
353,saad_novel_2022,article,"Saad, E. and Sadiq, S. and Jamil, R. and Rustam, F. and Mehmood, A. and Choi, G.S. and Ashraf, I.",0.0,1.0,,,10.1371/journal.pone.0270327,,,PLoS ONE,,6 June,,,,Novel extreme regression-voting classifier to predict death risk in vaccinated people using {VAERS} data,https://www.scopus.com/inward/record.uri?eid=2-s2.0-85133214365&doi=10.1371%2fjournal.pone.0270327&partnerID=40&md5=5cfaf0660b4d1e5884d933f357444c87,17,2022.0,O,,,,,,,,,,,,,,,,,,,,,,,,,,,,,,,,,,,,,,,,,,,,,,,,,,,,,,,,,,,,,,,,,,,,,,,,,,,,,,,,,,,,,,,,,,,,,,,,,,,,,,,,,,,,,,,,,,,,,,,,,,,
354,sai_generative_2024,article,"Sai, Siva and Gaur, Aanchal and Sai, Revant and Chamola, Vinay and Guizani, Mohsen and Rodrigues, Joel JPC",1.0,0.0,,,,,2169-3536,IEEE Access,Publisher: IEEE,,,,,"Generative {AI} for {Transformative} {Healthcare}: {A} {Comprehensive} {Study} of {Emerging} {Models}, {Applications}, {Case} {Studies} and {Limitations}",,,2024.0,[Review],,,,,,,,,,,,,,,,,,,,,,,,,,,,,,,,,,,,,,,,,,,,,,,,,,,,,,,,,,,,,,,,,,,,,,,,,,,,,,,,,,,,,,,,,,,,,,,,,,,,,,,,,,,,,,,,,,,,,,,,,,,
355,santos_inteligencia_2024,article,"Santos, Valdislene Silva dos and Sousa, Sara Jane Almeida de and Santos, Layrane Mayara Lino and Mendes Filho, Luiz Augusto Machado and Porte, Marcelo de Santana and Taveira, Marcelo da Silva and Alexandre, Mauro Lemuel de Oliveira",1.0,0.0,,,,,1982-6125,Revista Brasileira de Pesquisa em Turismo,Publisher: SciELO Brasil,,e--2896,,,Inteligência artificial nos estudos e pesquisas em {Turismo} no {Brasil},,18,2024.0,[NonEnglish],,,,,,,,,,,,,,,,,,,,,,,,,,,,,,,,,,,,,,,,,,,,,,,,,,,,,,,,,,,,,,,,,,,,,,,,,,,,,,,,,,,,,,,,,,,,,,,,,,,,,,,,,,,,,,,,,,,,,,,,,,,
356,sarkar_-identification_2024,article,"Sarkar, Atiquer Rahman and Chuang, Yao-Shun and Mohammed, Noman and Jiang, Xiaoqian",1.0,0.0,,,,,,arXiv preprint arXiv:2402.00179,,,,,,De-identification is not always enough,,,2024.0,SD,0.0,1.0,0.0,,,,,,,,,,,,,,,,,,,,,,,,,,,,,,,,,,,,,,,,,,,,,,,,,,,,,,,,,,,,,,,,,,,,,,,,,,,,,,,,,,,,,,,,,,,,,,,,,,,,,,,,,,,,,,,,,,,,,,,,
357,sbodio_encoding_2021,inproceedings,"Sbodio, M.L. and Mulligan, N. and Speichert, S. and Lopez, V. and Bettencourt-Silva, J.",0.0,1.0,,,10.3233/SHTI210800,,,,,,8--12,,,Encoding {Health} {Records} into {Pathway} {Representations} for {Deep} {Learning},https://www.scopus.com/inward/record.uri?eid=2-s2.0-85120522915&doi=10.3233%2fSHTI210800&partnerID=40&md5=f34001de9328d0c096b9b7b079a7cb6a,287,2021.0,[No PET],,,,,,,,,,,,,,,,,,,,,,,,,,,,,,,,,,,,,,,,,,,,,,,,,,,,,,,,,,,,,,,,,,,,,,,,,,,,,,,,,,,,,,,,,,,,,,,,,,,,,,,,,,,,,,,,,,,,,,,,,,,
358,sboev_extraction_2022,article,"Sboev, Alexander and Selivanov, Anton and Moloshnikov, Ivan and Rybka, Roman and Gryaznov, Artem and Sboeva, Sanna and Rylkov, Gleb",1.0,0.0,,,,,2504-2289,Big Data and Cognitive Computing,Publisher: MDPI,1,10,,,Extraction of the relations among significant pharmacological entities in {Russian}-language reviews of internet users on medications,,6,2022.0,[NonEHR Data],,,,,,,,,,,,,,,,,,,,,,,,,,,,,,,,,,,,,,,,,,,,,,,,,,,,,,,,,,,,,,,,,,,,,,,,,,,,,,,,,,,,,,,,,,,,,,,,,,,,,,,,,,,,,,,,,,,,,,,,,,,
359,schrempf_templated_2021,article,"Schrempf, Patrick and Watson, Hannah and Park, Eunsoo and Pajak, Maciej and MacKinnon, Hamish and Muir, Keith W and Harris-Birtill, David and O’Neil, Alison Q",1.0,0.0,,,,,2504-4990,Machine Learning and Knowledge Extraction,Publisher: MDPI,2,299--317,,,Templated text synthesis for expert-guided multi-label extraction from radiology reports,,3,2021.0,[No PET],,,,,,,,,,,,,,,,,,,,,,,,,,,,,,,,,,,,,,,,,,,,,,,,,,,,,,,,,,,,,,,,,,,,,,,,,,,,,,,,,,,,,,,,,,,,,,,,,,,,,,,,,,,,,,,,,,,,,,,,,,,
360,searle_methods_2023,article,"Searle, Thomas and Ibrahim, Zina",1.0,0.0,,,,,,,Publisher: King’s College London,,,,,Methods and {Applications} for {Summarising} {Free}-{Text} {Narratives} in {Electronic} {Health} {Records},,,2023.0,[No PET],,,,,,,,,,,,,,,,,,,,,,,,,,,,,,,,,,,,,,,,,,,,,,,,,,,,,,,,,,,,,,,,,,,,,,,,,,,,,,,,,,,,,,,,,,,,,,,,,,,,,,,,,,,,,,,,,,,,,,,,,,,
361,seminar_school_2024,article,"Seminar, Francesco Busolin IR and Seminar, Franco Maria Nardini IR and Seminar, Clemencia Siro IR",1.0,0.0,,,,,,,,,,,,School of {Computing} {Science},,,2024.0,[Insufficient Info],,,,,,,,,,,,,,,,,,,,,,,,,,,,,,,,,,,,,,,,,,,,,,,,,,,,,,,,,,,,,,,,,,,,,,,,,,,,,,,,,,,,,,,,,,,,,,,,,,,,,,,,,,,,,,,,,,,,,,,,,,,
362,sengupta_determining_2023,inproceedings,"Sengupta, S. and Loomba, J. and Sharma, S. and Chapman, S.A. and Brown, D.E.",0.0,1.0,,,10.1109/ICMLA58977.2023.00066,,,,,,430--436,,,Determining {Risk} {Factors} for {Long} {COVID} {Using} {Positive} {Unlabeled} {Learning} on {Electronic} {Health} {Records} {Data} from {NIH} {N3C},https://www.scopus.com/inward/record.uri?eid=2-s2.0-85190109661&doi=10.1109%2fICMLA58977.2023.00066&partnerID=40&md5=cde8dd1e1ebfc5cf2cf462b058ce162d,,2023.0,O,,,,,,,,,,,,,,,,,,,,,,,,,,,,,,,,,,,,,,,,,,,,,,,,,,,,,,,,,,,,,,,,,,,,,,,,,,,,,,,,,,,,,,,,,,,,,,,,,,,,,,,,,,,,,,,,,,,,,,,,,,,
363,shae_transform_2018,inproceedings,"Shae, Z. and Tsai, J.J.P.",0.0,1.0,,,10.1109/ICDCS.2018.00129,,,,,,1290--1299,,,Transform blockchain into distributed parallel computing architecture for precision medicine,https://www.scopus.com/inward/record.uri?eid=2-s2.0-85050990504&doi=10.1109%2fICDCS.2018.00129&partnerID=40&md5=f42e9d811c0ad7eb1b405eb878e0a8ba,2018-July,2018.0,[No PET],,,,,,,,,,,,,,,,,,,,,,,,,,,,,,,,,,,,,,,,,,,,,,,,,,,,,,,,,,,,,,,,,,,,,,,,,,,,,,,,,,,,,,,,,,,,,,,,,,,,,,,,,,,,,,,,,,,,,,,,,,,
364,shah_maintaining_2021,inproceedings,"Shah, U. and Dave, I. and Malde, J. and Mehta, J. and Kodeboyina, S.",0.0,1.0,,,10.1109/I2CT51068.2021.9417997,,,,,,,,,"Maintaining {Privacy} in {Medical} {Imaging} with {Federated} {Learning}, {Deep} {Learning}, {Differential} {Privacy}, and {Encrypted} {Computation}",https://www.scopus.com/inward/record.uri?eid=2-s2.0-85106511501&doi=10.1109%2fI2CT51068.2021.9417997&partnerID=40&md5=d33472d56091337c2a3e99348435c1db,,2021.0,[Image],,,,,,,,,,,,,,,,,,,,,,,,,,,,,,,,,,,,,,,,,,,,,,,,,,,,,,,,,,,,,,,,,,,,,,,,,,,,,,,,,,,,,,,,,,,,,,,,,,,,,,,,,,,,,,,,,,,,,,,,,,,
365,shahab_large_2024,article,"Shahab, Omer and El Kurdi, Bara and Shaukat, Aasma and Nadkarni, Girish and Soroush, Ali",1.0,0.0,,,,,1756-2848,Therapeutic Advances in Gastroenterology,"Publisher: SAGE Publications Sage UK: London, England",,17562848241227031,,,Large language models: a primer and gastroenterology applications,,17,2024.0,[Review],,,,,,,,,,,,,,,,,,,,,,,,,,,,,,,,,,,,,,,,,,,,,,,,,,,,,,,,,,,,,,,,,,,,,,,,,,,,,,,,,,,,,,,,,,,,,,,,,,,,,,,,,,,,,,,,,,,,,,,,,,,
366,shaikh_towards_2021,article,"Shaikh, Sarang and Daudpota, Sher Muhammad and Imran, Ali Shariq and Kastrati, Zenun",1.0,0.0,,,,,2076-3417,Applied Sciences,Publisher: MDPI,2,869,,,Towards improved classification accuracy on highly imbalanced text dataset using deep neural language models,,11,2021.0,SD,0.0,1.0,0.0,,,,,,,,,,,,,,,,,,,,,,,,,,,,,,,,,,,,,,,,,,,,,,,,,,,,,,,,,,,,,,,,,,,,,,,,,,,,,,,,,,,,,,,,,,,,,,,,,,,,,,,,,,,,,,,,,,,,,,,,
367,shang_gamenet_2019,inproceedings,"Shang, J. and Xiao, C. and Ma, T. and Li, H. and Sun, J.",0.0,1.0,,,,,,,,,1126--1133,,,{GAMENet}: {Graph} augmented memory networks for recommending medication combination,https://www.scopus.com/inward/record.uri?eid=2-s2.0-85081397082&partnerID=40&md5=fd7042d9156f546c6836432641eeb47b,,2019.0,O,,,,,,,,,,,,,,,,,,,,,,,,,,,,,,,,,,,,,,,,,,,,,,,,,,,,,,,,,,,,,,,,,,,,,,,,,,,,,,,,,,,,,,,,,,,,,,,,,,,,,,,,,,,,,,,,,,,,,,,,,,,
368,shang_pre-training_2019,inproceedings,"Shang, J. and Ma, T. and Xiao, C. and Sun, J.",0.0,1.0,,,10.24963/ijcai.2019/825,,,,,,5953--5959,,,Pre-training of graph augmented transformers for medication recommendation,https://www.scopus.com/inward/record.uri?eid=2-s2.0-85074900402&doi=10.24963%2fijcai.2019%2f825&partnerID=40&md5=a142e7568371ef790e6574d41003f6da,2019-August,2019.0,O,,,,,,,,,,,,,,,,,,,,,,,,,,,,,,,,,,,,,,,,,,,,,,,,,,,,,,,,,,,,,,,,,,,,,,,,,,,,,,,,,,,,,,,,,,,,,,,,,,,,,,,,,,,,,,,,,,,,,,,,,,,
369,siganporia_privacy-enhanced_2023,inproceedings,"Siganporia, A. and Varia, M. and Gorimar, U. and Nanade, A.",0.0,1.0,,,10.1109/GCITC60406.2023.10426518,,,,,,,,,Privacy-{Enhanced} {Federated} {Learning} for {Rare} {Genetic} {Disorder} {Classification} with {EHR},https://www.scopus.com/inward/record.uri?eid=2-s2.0-85191707511&doi=10.1109%2fGCITC60406.2023.10426518&partnerID=40&md5=eeee61d3bd21b82464f2aa40c88538ec,,2023.0,CL,1.0,0.0,0.0,,,,,,,,,,,,,,86.0,Siganporia A.; Varia M.; Gorimar U.; Nanade A.,"Siganporia, Afreen (59007810300); Varia, Maitree (59008422600); Gorimar, Uraaz (59007810400); Nanade, Archana (57193734702)",59007810300; 59008422600; 59007810400; 57193734702,Privacy-Enhanced Federated Learning for Rare Genetic Disorder Classification with EHR,2023.0,"2023 Global Conference on Information Technologies and Communications, GCITC 2023",,,,,,,0.0,10.1109/GCITC60406.2023.10426518,https://www.scopus.com/inward/record.uri?eid=2-s2.0-85191707511&doi=10.1109%2fGCITC60406.2023.10426518&partnerID=40&md5=eeee61d3bd21b82464f2aa40c88538ec,Conference paper,Final,,Scopus,2-s2.0-85191707511,FL,Disease Classification,,,1.0,0.0,0,0,0.0,0.0,0.0,0.0,0.0,0.0,0.0,0.0,0.0,0.0,0.0,Federated Learning,,CL,,,Tabular,"Kaggle, Of Genomes and Genetics",SNN,0.0,0.0,0.0,0.0,0.0,0.0,0.0,0.0,1.0,Central v. Single V. Federated,,0.0,0.0,0.0,0.0,1.0,0.0,0.0,0.0,1.0,0.0,0.0,0.0,0.0,0.0,0.0,0.0,0.0,0.0,0.0,0.0,0.0,0.0,0.0,0.0,0.0,0.0,0.0,0.0,0.0,0.0,0.0,0.0,0.0,0.0,0.0,0.0,0.0,0.0,0.0,0.0,0.0,Genetics,-,-,,6% improvement over indivdual hospital models,,
370,silva_modelling_2022,article,"Silva, J.F. and Matos, S.",0.0,1.0,,,10.1016/j.jbi.2022.104195,,,Journal of Biomedical Informatics,,,,,,Modelling patient trajectories using multimodal information,https://www.scopus.com/inward/record.uri?eid=2-s2.0-85138488865&doi=10.1016%2fj.jbi.2022.104195&partnerID=40&md5=58a93e378a128cdf157b08ecf33e7101,134,2022.0,O,,,,,,,,,,,,,,,,,,,,,,,,,,,,,,,,,,,,,,,,,,,,,,,,,,,,,,,,,,,,,,,,,,,,,,,,,,,,,,,,,,,,,,,,,,,,,,,,,,,,,,,,,,,,,,,,,,,,,,,,,,,
371,singh_comprehensive_2024,inproceedings,"Singh, Y. and Jaiswal, S. and Kumar, V.",0.0,1.0,,,10.1109/ICDT61202.2024.10489013,,,,,,220--224,,,"A {Comprehensive} {Literature} {Review} on {Privacy}, {Security}, and {Data} {Management} in {Healthcare}",https://www.scopus.com/inward/record.uri?eid=2-s2.0-85191257529&doi=10.1109%2fICDT61202.2024.10489013&partnerID=40&md5=299dba9502ec4986c8a6b6a041e5b046,,2024.0,[Review],,,,,,,,,,,,,,,,,,,,,,,,,,,,,,,,,,,,,,,,,,,,,,,,,,,,,,,,,,,,,,,,,,,,,,,,,,,,,,,,,,,,,,,,,,,,,,,,,,,,,,,,,,,,,,,,,,,,,,,,,,,
372,skrlj_compressibility_2021,inproceedings,"Skrlj, B. and Petkovic, M.",0.0,1.0,,,10.1109/ICDM51629.2021.00166,,,,,,1330--1335,,,Compressibility of {Distributed} {Document} {Representations},https://www.scopus.com/inward/record.uri?eid=2-s2.0-85125207352&doi=10.1109%2fICDM51629.2021.00166&partnerID=40&md5=0952ea042a4df85e2384e48a91923ee4,2021-December,2021.0,O,,,,,,,,,,,,,,,,,,,,,,,,,,,,,,,,,,,,,,,,,,,,,,,,,,,,,,,,,,,,,,,,,,,,,,,,,,,,,,,,,,,,,,,,,,,,,,,,,,,,,,,,,,,,,,,,,,,,,,,,,,,
373,socrates_predicting_2023,article,"Socrates, V. and Gilson, A. and Lopez, K. and Chi, L. and Taylor, R.A. and Chartash, D.",0.0,1.0,,,10.1016/j.jbi.2023.104360,,,Journal of Biomedical Informatics,,,,,,Predicting relations between {SOAP} note sections: {The} value of incorporating a clinical information model,https://www.scopus.com/inward/record.uri?eid=2-s2.0-85152615536&doi=10.1016%2fj.jbi.2023.104360&partnerID=40&md5=0f97778117f11c7f241eb866c425ce2b,141,2023.0,[No PET],,,,,,,,,,,,,,,,,,,,,,,,,,,,,,,,,,,,,,,,,,,,,,,,,,,,,,,,,,,,,,,,,,,,,,,,,,,,,,,,,,,,,,,,,,,,,,,,,,,,,,,,,,,,,,,,,,,,,,,,,,,
374,song_llm-based_2024,article,"Song, Yiping and Zhang, Juhua and Tian, Zhiliang and Yang, Yuxin and Huang, Minlie and Li, Dongsheng",1.0,0.0,,,,,,arXiv preprint arXiv:2402.16515,,,,,,{LLM}-based {Privacy} {Data} {Augmentation} {Guided} by {Knowledge} {Distillation} with a {Distribution} {Tutor} for {Medical} {Text} {Classification},,,2024.0,DP-SD,0.0,1.0,0.0,,,,,,,,,,,,,,,,,,,,,,,,,,,,,,,,,,,,,,,,,,,,,,,,,,,,,,,,,,,,,,,,,,,,,,,,,,,,,,,,,,,,,,,,,,,,,,,,,,,,,,,,,,,,,,,,,,,,,,,,
