ID,ENTRYTYPE,author,bib-gs_bronze_gquerya,bib-scopus_bronze_querya,bib_id,booktitle,doi,isbn,issn,journal,note,number,pages,publisher,shorttitle,title,url,volume,year
peine_deep_2019,article,"Peine, A. and Hallawa, A. and Schöffski, O. and Dartmann, G. and Fazlic, L.B. and Schmeink, A. and Marx, G. and Martin, L.",0,1,nan,nan,10.2196/14806,nan,nan,JMIR Medical Informatics,nan,4,nan,nan,nan,A deep learning approach for managing medical consumable materials in intensive care units via convolutional neural networks: {Technical} proof-of-concept study,https://www.scopus.com/inward/record.uri?eid=2-s2.0-85091690899&doi=10.2196%2f14806&partnerID=40&md5=666a6436f62355980a25f5d6bf0efdb5,7,2019.0
peis_deep_2019,article,"Peis, I. and Olmos, P.M. and Vera-Varela, C. and Barrigon, M.L. and Courtet, P. and Baca-Garcia, E. and Artes-Rodriguez, A.",0,1,nan,nan,10.1109/JBHI.2019.2919270,nan,nan,IEEE Journal of Biomedical and Health Informatics,nan,6,2286--2293,nan,nan,Deep {Sequential} {Models} for {Suicidal} {Ideation} from {Multiple} {Source} {Data},https://www.scopus.com/inward/record.uri?eid=2-s2.0-85071729565&doi=10.1109%2fJBHI.2019.2919270&partnerID=40&md5=84c2eafcfff8d9494d93f80979c2eeff,23,2019.0
pellecchia_leveraging_2022,article,"Pellecchia, Riccardo",1,0,nan,nan,nan,nan,nan,nan,nan,nan,nan,nan,nan,Leveraging {AI} via speech-to-text and {LLM} integration for improved healthcare decision-making in primary care,nan,nan,2022.0
peng_-depth_2024,article,"Peng, Le and Luo, Gaoxiang and Zhou, Sicheng and Chen, Jiandong and Xu, Ziyue and Sun, Ju and Zhang, Rui Peng, L. and Luo, G. and Zhou, S. and Chen, J. and Xu, Z. and Sun, J. and Zhang, R.",1,1,nan,nan,nan 10.1038/s41746-024-01126-4,nan,2398-6352 nan,NPJ Digital Medicine npj Digital Medicine,Publisher: Nature Publishing Group UK London nan,1,127 nan,nan,nan,An in-depth evaluation of federated learning on biomedical natural language processing for information extraction,nan https://www.scopus.com/inward/record.uri?eid=2-s2.0-85193377702&doi=10.1038%2fs41746-024-01126-4&partnerID=40&md5=35639b07e8e9281754dd4827a4aa1ce0,7,2024.0
peng_study_2023,article,"Peng, C. and Yang, X. and Chen, A. and Smith, K.E. and PourNejatian, N. and Costa, A.B. and Martin, C. and Flores, M.G. and Zhang, Y. and Magoc, T. and Lipori, G. and Mitchell, D.A. and Ospina, N.S. and Ahmed, M.M. and Hogan, W.R. and Shenkman, E.A. and Guo, Y. and Bian, J. and Wu, Y.",0,1,nan,nan,10.1038/s41746-023-00958-w,nan,nan,npj Digital Medicine,nan,1,nan,nan,nan,A study of generative large language model for medical research and healthcare,https://www.scopus.com/inward/record.uri?eid=2-s2.0-85177043166&doi=10.1038%2fs41746-023-00958-w&partnerID=40&md5=f06447139be98245ab7a5d25fb263c56,6,2023.0
pereira_automated_2024,article,"Pereira, Sofia C and Mendonça, Ana Maria and Campilho, Aurélio and Sousa, Pedro and Lopes, Carla Teixeira",1,0,nan,nan,nan,nan,0933-3657,Artificial Intelligence in Medicine,Publisher: Elsevier,nan,102814,nan,nan,Automated image label extraction from radiology reports–{A} review,nan,nan,2024.0
peterson_automated_2021,article,"Peterson, K.S. and Lewis, J. and Patterson, O.V. and Chapman, A.B. and Denhalter, D.W. and Lye, P.A. and Stevens, V.W. and Gamage, S.D. and Roselle, G.A. and Wallace, K.S. and Jones, M.",0,1,nan,nan,10.2196/26719,nan,nan,JMIR Public Health and Surveillance,nan,3,nan,nan,nan,Automated travel history extraction from clinical notes for informing the detection of emergent infectious disease events: {Algorithm} development and validation,https://www.scopus.com/inward/record.uri?eid=2-s2.0-85103483736&doi=10.2196%2f26719&partnerID=40&md5=cdcbc03bf8d174d1c588a7e3d7a2ceaa,7,2021.0
petit-jean_collaborative_2024,article,"Petit-Jean, Thomas and Gérardin, Christel and Berthelot, Emmanuelle and Chatellier, Gilles and Frank, Marie and Tannier, Xavier and Kempf, Emmanuelle and Bey, Romain Petit-Jean, T. and Gérardin, C. and Berthelot, E. and Chatellier, G. and Frank, M. and Tannier, X. and Kempf, E. and Bey, R.",1,1,nan,nan,nan 10.1093/jamia/ocae069,nan,1067-5027 nan,Journal of the American Medical Informatics Association,Publisher: Oxford University Press nan,6,1280--1290,nan,nan,Collaborative and privacy-enhancing workflows on a clinical data warehouse: an example developing natural language processing pipelines to detect medical conditions,nan https://www.scopus.com/inward/record.uri?eid=2-s2.0-85193943907&doi=10.1093%2fjamia%2focae069&partnerID=40&md5=245759de13dda0e892b2e5888aba5c67,31,2024.0
phan_simple_2022,inproceedings,"Phan, U.T.P. and Nguyen, N.T.H.",0,1,nan,nan,nan,nan,nan,nan,nan,nan,123--129,nan,nan,Simple {Semantic}-based {Data} {Augmentation} for {Named} {Entity} {Recognition} in {Biomedical} {Texts},https://www.scopus.com/inward/record.uri?eid=2-s2.0-85138477267&partnerID=40&md5=1049345bb9b967a71eb7a1c2b05875d5,nan,2022.0
poquiz_navigating_2024,article,"Poquiz, Warren",1,0,nan,nan,nan,nan,2771-0335,TWU Student Journal,nan,1,nan,nan,nan,Navigating the {Risks} of {Artificial} {Intelligence} {Foundation} {Models} in {Healthcare}: {How} {Health} {Systems} {Can} {Respond},nan,3,2024.0
pozdeyev_thyroid_2024,article,"Pozdeyev, N. and Dighe, M. and Barrio, M. and Raeburn, C. and Smith, H. and Fisher, M. and Chavan, S. and Rafaels, N. and Shortt, J.A. and Lin, M. and Leu, M.G. and Clark, T. and Marshall, C. and Haugen, B.R. and Subramanian, D. and Crooks, K. and Gignoux, C. and Cohen, T.",0,1,nan,nan,10.1210/clinem/dgad530,nan,nan,Journal of Clinical Endocrinology and Metabolism,nan,2,402--412,nan,nan,Thyroid {Cancer} {Polygenic} {Risk} {Score} {Improves} {Classification} of {Thyroid} {Nodules} as {Benign} or {Malignant},https://www.scopus.com/inward/record.uri?eid=2-s2.0-85195269389&doi=10.1210%2fclinem%2fdgad530&partnerID=40&md5=7e883b61f3a205ae762890a4cf737633,109,2024.0
preiksaitis_role_2024,article,"Preiksaitis, Carl and Ashenburg, Nicholas and Bunney, Gabrielle and Chu, Andrew and Kabeer, Rana and Riley, Fran and Ribeira, Ryan and Rose, Christian",1,0,nan,nan,nan,nan,2291-9694,JMIR Medical Informatics,"Publisher: JMIR Publications Toronto, Canada",nan,e53787,nan,nan,The {Role} of {Large} {Language} {Models} in {Transforming} {Emergency} {Medicine}: {Scoping} {Review},nan,12,2024.0
premananthan_new_2023,article,"Premananthan, G. and Nagaraj, B. and Jaya, J.",0,1,nan,nan,10.3233/JIFS-223354,nan,nan,Journal of Intelligent and Fuzzy Systems,nan,6,9027--9037,nan,nan,A new {AI} assisted medical molecular image diagnostic model,https://www.scopus.com/inward/record.uri?eid=2-s2.0-85166392010&doi=10.3233%2fJIFS-223354&partnerID=40&md5=cb8748f5d8a5a3252c5a964bac76f01a,44,2023.0
puche_fitvoice_2024,article,"Puche, Diego and Jiménez, Kemer and Sierra, Miguel",1,0,nan,nan,nan,nan,nan,nan,"Publisher: Barranquilla, Universidad del Norte, 2024",nan,nan,nan,nan,"{FitVoice}, un aplicativo móvil de registro de dieta usando modelos de speech-to-text y grandes modelos de lenguaje",nan,nan,2024.0
qi_ai_2024,article,"Qi, Xiangyu and Huang, Yangsibo and Zeng, Yi and Debenedetti, Edoardo and Geiping, Jonas and He, Luxi and Huang, Kaixuan and Madhushani, Udari and Sehwag, Vikash and Shi, Weijia",1,0,nan,nan,nan,nan,nan,arXiv preprint arXiv:2405.19524,nan,nan,nan,nan,nan,{AI} {Risk} {Management} {Should} {Incorporate} {Both} {Safety} and {Security},nan,nan,2024.0
qiao_pairwise-ranking_2018,inproceedings,"Qiao, Z. and Zhao, S. and Xiao, C. and Li, X. and Qin, Y. and Wang, F.",0,1,nan,nan,10.24963/ijcai.2018/489,nan,nan,nan,nan,nan,3520--3526,nan,nan,Pairwise-ranking based collaborative recurrent neural networks for clinical event prediction,https://www.scopus.com/inward/record.uri?eid=2-s2.0-85055673981&doi=10.24963%2fijcai.2018%2f489&partnerID=40&md5=382a8bad14315518c0ae7fd389c6211c,2018-July,2018.0
ragab_blockchain-driven_2024,article,"Ragab, M. and Bahaddad, A.A. and Hamed, D. and Alkhayyat, A. and Gupta, D. and Mansour, R.F.",0,1,nan,nan,10.22967/HCIS.2024.14.009,nan,nan,Human-centric Computing and Information Sciences,nan,nan,nan,nan,nan,Blockchain-{Driven} {Privacy} {Preserving} {Electronic} {Health} {Records} {Analysis} {Using} {Sine} {Cosine} {Algorithm} with {Deep} {Learning} {Model},https://www.scopus.com/inward/record.uri?eid=2-s2.0-85189101851&doi=10.22967%2fHCIS.2024.14.009&partnerID=40&md5=8b8305ef961c92e47a5fb9e6abfc267a,14,2024.0
raiaan_review_2024,article,"Raiaan, Mohaimenul Azam Khan and Mukta, Md Saddam Hossain and Fatema, Kaniz and Fahad, Nur Mohammad and Sakib, Sadman and Mim, Most Marufatul Jannat and Ahmad, Jubaer and Ali, Mohammed Eunus and Azam, Sami",1,0,nan,nan,nan,nan,2169-3536,IEEE Access,Publisher: IEEE,nan,nan,nan,nan,"A review on large {Language} {Models}: {Architectures}, applications, taxonomies, open issues and challenges",nan,nan,2024.0
raiskin_categorization_2019,article,"Raiskin, Y. and Eickhoff, C. and Beeler, P.E.",0,1,nan,nan,10.1016/j.ijmedinf.2019.05.020,nan,nan,International Journal of Medical Informatics,nan,nan,20--28,nan,nan,Categorization of free-text drug orders using character-level recurrent neural networks,https://www.scopus.com/inward/record.uri?eid=2-s2.0-85066256239&doi=10.1016%2fj.ijmedinf.2019.05.020&partnerID=40&md5=aadd2834360f0b365c336cb729499a20,129,2019.0
rajashekar_human-algorithmic_2024,inproceedings,"Rajashekar, N.C. and Shin, Y.E. and Pu, Y. and Chung, S. and You, K. and Giuffre, M. and Chan, C.E. and Saarinen, T. and Hsiao, A. and Sekhon, J. and Wong, A.H. and Evans, L.V. and Kizilcec, R.F. and Laine, L. and McCall, T. and Shung, D.",0,1,nan,nan,10.1145/3613904.3642024,nan,nan,nan,nan,nan,nan,nan,nan,Human-{Algorithmic} {Interaction} {Using} a {Large} {Language} {Model}-{Augmented} {Artificial} {Intelligence} {Clinical} {Decision} {Support} {System},https://www.scopus.com/inward/record.uri?eid=2-s2.0-85194877819&doi=10.1145%2f3613904.3642024&partnerID=40&md5=db6c7d5e4f61bca623e8ee38e06c23bf,nan,2024.0
rajeshkumar_efficient_2024,article,"Rajeshkumar, K. and Dhanasekaran, S. and Vasudevan, V.",0,1,nan,nan,10.1007/s11042-023-17381-8,nan,nan,Multimedia Tools and Applications,nan,16,47111--47138,nan,nan,Efficient and secure medical big data management system using optimal map-reduce framework and deep learning,https://www.scopus.com/inward/record.uri?eid=2-s2.0-85174835358&doi=10.1007%2fs11042-023-17381-8&partnerID=40&md5=b30c949a7bddc120a933fbeace8b506b,83,2024.0
ramsdale_introduction_2021,article,"Ramsdale, E. and Snyder, E. and Culakova, E. and Xu, H. and Dziorny, A. and Yang, S. and Zand, M. and Anand, A.",0,1,nan,nan,10.1016/j.jgo.2021.03.012,nan,nan,Journal of Geriatric Oncology,nan,8,1159--1163,nan,nan,An introduction to machine learning for clinicians: {How} can machine learning augment knowledge in geriatric oncology?,https://www.scopus.com/inward/record.uri?eid=2-s2.0-85103392183&doi=10.1016%2fj.jgo.2021.03.012&partnerID=40&md5=bb5019799c8447a6c1ce86b8d45e80e0,12,2021.0
rao_targeted-behrt_2024,article,"Rao, S. and Mamouei, M. and Salimi-Khorshidi, G. and Li, Y. and Ramakrishnan, R. and Hassaine, A. and Canoy, D. and Rahimi, K.",0,1,nan,nan,10.1109/TNNLS.2022.3183864,nan,nan,IEEE Transactions on Neural Networks and Learning Systems,nan,4,5027--5038,nan,nan,Targeted-{BEHRT}: {Deep} {Learning} for {Observational} {Causal} {Inference} on {Longitudinal} {Electronic} {Health} {Records},https://www.scopus.com/inward/record.uri?eid=2-s2.0-85133757812&doi=10.1109%2fTNNLS.2022.3183864&partnerID=40&md5=15dfc2783616899114317801336bae4c,35,2024.0
raparthi_biomedical_2023,article,"Raparthi, M. and Dodda, S.B. and Maruthi, S.",0,1,nan,nan,10.52783/dxjb.v35.114,nan,nan,Dandao Xuebao/Journal of Ballistics,nan,1,52--61,nan,nan,Biomedical {Text} {Mining} for {Drug} {Discovery} using {Natural} {Language} {Processing} and {Deep} {Learning}.,https://www.scopus.com/inward/record.uri?eid=2-s2.0-85185814608&doi=10.52783%2fdxjb.v35.114&partnerID=40&md5=969e2ec8a1af8abdad1046837e362648,35,2023.0
rasmy_training_2023,inproceedings,"Rasmy, L. and Xie, Z. and Zhi, D.",0,1,nan,nan,10.1109/ICHI57859.2023.00094,nan,nan,nan,nan,nan,529--530,nan,nan,Training {Recurrent} {Neural} {Network}-{Based} {Model} to {Predict} {COVID}-19 {Patient} {Risk} for {PASC} using {Pytorch}-{EHR} - {Hands}-on {Tutorial} on {N3C},https://www.scopus.com/inward/record.uri?eid=2-s2.0-85181559211&doi=10.1109%2fICHI57859.2023.00094&partnerID=40&md5=c4b62d415075b1b8806e1cab221e63df,nan,2023.0
razmi_ai_2024,book,"Razmi, Ronald M",1,0,nan,nan,nan,1-394-24016-3,nan,nan,nan,nan,nan,John Wiley \& Sons,nan,"{AI} {Doctor}: {The} {Rise} of {Artificial} {Intelligence} in {Healthcare}-{A} {Guide} for {Users}, {Buyers}, {Builders}, and {Investors}",nan,nan,2024.0
rebane_exploiting_2020,article,"Rebane, J. and Samsten, I. and Papapetrou, P.",0,1,nan,nan,10.1016/j.artmed.2020.101942,nan,nan,Artificial Intelligence in Medicine,nan,nan,nan,nan,nan,Exploiting complex medical data with interpretable deep learning for adverse drug event prediction,https://www.scopus.com/inward/record.uri?eid=2-s2.0-85091563501&doi=10.1016%2fj.artmed.2020.101942&partnerID=40&md5=05d5c48d21546897f21c2b6b551d6521,109,2020.0
reddy_translational_2023,book,"Reddy, Sandeep",1,0,nan,nan,nan,1-00-381620-7,nan,nan,nan,nan,nan,CRC Press,nan,Translational {Application} of {Artificial} {Intelligence} in {Healthcare}:-{A} {Textbook},nan,nan,2023.0
rehman_fedcscd-gan_2024,article,"Rehman, A. and Xing, H. and Feng, L. and Hussain, M. and Gulzar, N. and Adnan Khan, M. and Hussain, A. and Saeed, D.",0,1,nan,nan,10.1016/j.bspc.2023.105893,nan,nan,Biomedical Signal Processing and Control,nan,nan,nan,nan,nan,{FedCSCD}-{GAN}: {A} secure and collaborative framework for clinical cancer diagnosis via optimized federated learning and {GAN},https://www.scopus.com/inward/record.uri?eid=2-s2.0-85181701119&doi=10.1016%2fj.bspc.2023.105893&partnerID=40&md5=3c99b38dcc30374c37e8293ba8c94cff,89,2024.0
reichenpfader_large_2023,article,"Reichenpfader, D. and Müller, H. and Denecke, K.",0,1,nan,nan,10.1136/bmjopen-2023-076865,nan,nan,BMJ Open,nan,12,nan,nan,nan,Large language model-based information extraction from free-text radiology reports: a scoping review protocol,https://www.scopus.com/inward/record.uri?eid=2-s2.0-85179647032&doi=10.1136%2fbmjopen-2023-076865&partnerID=40&md5=381abb7143b61074e332975b9b152099,13,2023.0
rekabdar_machine_2022,article,"Rekabdar, B. and Albright, D. and McDaniel, J.T. and Talafha, S. and Jeong, H.",0,1,nan,nan,10.1016/j.health.2022.100104,nan,nan,Healthcare Analytics,nan,nan,nan,nan,nan,From machine learning to deep learning: {A} comprehensive study of alcohol and drug use disorder,https://www.scopus.com/inward/record.uri?eid=2-s2.0-85148478764&doi=10.1016%2fj.health.2022.100104&partnerID=40&md5=3288b36b782c62f8af4123de36fd7ca4,2,2022.0
remadi_prompt_2024,article,"Remadi, Adel and El Hage, Karim and Hobeika, Yasmina and Bugiotti, Francesca",1,0,nan,nan,nan,nan,0169-023X,Data \& Knowledge Engineering,Publisher: Elsevier,nan,102313,nan,nan,To prompt or not to prompt: {Navigating} the use of large language models for integrating and modeling heterogeneous data,nan,152,2024.0
ren_generative_2022,inproceedings,"Ren, H. and Wang, J. and Zhao, W.X.",0,1,nan,nan,10.1145/3534678.3539020,nan,nan,nan,nan,nan,3810--3818,nan,nan,Generative {Adversarial} {Networks} {Enhanced} {Pre}-training for {Insufficient} {Electronic} {Health} {Records} {Modeling},https://www.scopus.com/inward/record.uri?eid=2-s2.0-85137147308&doi=10.1145%2f3534678.3539020&partnerID=40&md5=ee387b3c6b85391e67a4ce735cb491e7,nan,2022.0
riviere_proceedings_2024,inproceedings,"Rivière, J.G. and Soler Palacín, P. and Butte, M.J.",0,1,nan,nan,10.1016/j.jaci.2024.01.002,nan,nan,nan,Issue: 3,nan,637--642,nan,nan,Proceedings from the inaugural {Artificial} {Intelligence} in {Primary} {Immune} {Deficiencies} ({AIPID}) conference,https://www.scopus.com/inward/record.uri?eid=2-s2.0-85185775549&doi=10.1016%2fj.jaci.2024.01.002&partnerID=40&md5=13a550434e9ffeb43c812886277ca12e,153,2024.0
rodriguez-diaz_real-time_2021,inproceedings,"Rodriguez-Diaz, E. and Baffy, G. and Lo, W.-K. and Mashimo, H. and Vidyarthi, G. and Mohapatra, S.S. and Singh, S.K.",0,1,nan,nan,10.1016/j.gie.2020.09.018,nan,nan,nan,Issue: 3,nan,662--670,nan,nan,Real-time artificial intelligence–based histologic classification of colorectal polyps with augmented visualization,https://www.scopus.com/inward/record.uri?eid=2-s2.0-85096436185&doi=10.1016%2fj.gie.2020.09.018&partnerID=40&md5=66a021f92136cf074cc3b411fa817143,93,2021.0
rouzrokh_mitigating_2022,article,"Rouzrokh, P. and Khosravi, B. and Faghani, S. and Moassefi, M. and Garcia, D.V.V. and Singh, Y. and Zhang, K. and Conte, G.M. and Erickson, B.J.",0,1,nan,nan,10.1148/ryai.210290,nan,nan,Radiology: Artificial Intelligence,nan,5,nan,nan,nan,Mitigating {Bias} in {Radiology} {Machine} {Learning}: 1. {Data} {Handling},https://www.scopus.com/inward/record.uri?eid=2-s2.0-85139164638&doi=10.1148%2fryai.210290&partnerID=40&md5=8c56534ac9f13ea5eb9431a1fdb48265,4,2022.0
saad_novel_2022,article,"Saad, E. and Sadiq, S. and Jamil, R. and Rustam, F. and Mehmood, A. and Choi, G.S. and Ashraf, I.",0,1,nan,nan,10.1371/journal.pone.0270327,nan,nan,PLoS ONE,nan,6 June,nan,nan,nan,Novel extreme regression-voting classifier to predict death risk in vaccinated people using {VAERS} data,https://www.scopus.com/inward/record.uri?eid=2-s2.0-85133214365&doi=10.1371%2fjournal.pone.0270327&partnerID=40&md5=5cfaf0660b4d1e5884d933f357444c87,17,2022.0
sai_generative_2024,article,"Sai, Siva and Gaur, Aanchal and Sai, Revant and Chamola, Vinay and Guizani, Mohsen and Rodrigues, Joel JPC",1,0,nan,nan,nan,nan,2169-3536,IEEE Access,Publisher: IEEE,nan,nan,nan,nan,"Generative {AI} for {Transformative} {Healthcare}: {A} {Comprehensive} {Study} of {Emerging} {Models}, {Applications}, {Case} {Studies} and {Limitations}",nan,nan,2024.0
santos_inteligencia_2024,article,"Santos, Valdislene Silva dos and Sousa, Sara Jane Almeida de and Santos, Layrane Mayara Lino and Mendes Filho, Luiz Augusto Machado and Porte, Marcelo de Santana and Taveira, Marcelo da Silva and Alexandre, Mauro Lemuel de Oliveira",1,0,nan,nan,nan,nan,1982-6125,Revista Brasileira de Pesquisa em Turismo,Publisher: SciELO Brasil,nan,e--2896,nan,nan,Inteligência artificial nos estudos e pesquisas em {Turismo} no {Brasil},nan,18,2024.0
sarkar_-identification_2024,article,"Sarkar, Atiquer Rahman and Chuang, Yao-Shun and Mohammed, Noman and Jiang, Xiaoqian",1,0,nan,nan,nan,nan,nan,arXiv preprint arXiv:2402.00179,nan,nan,nan,nan,nan,De-identification is not always enough,nan,nan,2024.0
sbodio_encoding_2021,inproceedings,"Sbodio, M.L. and Mulligan, N. and Speichert, S. and Lopez, V. and Bettencourt-Silva, J.",0,1,nan,nan,10.3233/SHTI210800,nan,nan,nan,nan,nan,8--12,nan,nan,Encoding {Health} {Records} into {Pathway} {Representations} for {Deep} {Learning},https://www.scopus.com/inward/record.uri?eid=2-s2.0-85120522915&doi=10.3233%2fSHTI210800&partnerID=40&md5=f34001de9328d0c096b9b7b079a7cb6a,287,2021.0
sboev_extraction_2022,article,"Sboev, Alexander and Selivanov, Anton and Moloshnikov, Ivan and Rybka, Roman and Gryaznov, Artem and Sboeva, Sanna and Rylkov, Gleb",1,0,nan,nan,nan,nan,2504-2289,Big Data and Cognitive Computing,Publisher: MDPI,1,10,nan,nan,Extraction of the relations among significant pharmacological entities in {Russian}-language reviews of internet users on medications,nan,6,2022.0
schrempf_templated_2021,article,"Schrempf, Patrick and Watson, Hannah and Park, Eunsoo and Pajak, Maciej and MacKinnon, Hamish and Muir, Keith W and Harris-Birtill, David and O’Neil, Alison Q",1,0,nan,nan,nan,nan,2504-4990,Machine Learning and Knowledge Extraction,Publisher: MDPI,2,299--317,nan,nan,Templated text synthesis for expert-guided multi-label extraction from radiology reports,nan,3,2021.0
searle_methods_2023,article,"Searle, Thomas and Ibrahim, Zina",1,0,nan,nan,nan,nan,nan,nan,Publisher: King’s College London,nan,nan,nan,nan,Methods and {Applications} for {Summarising} {Free}-{Text} {Narratives} in {Electronic} {Health} {Records},nan,nan,2023.0
seminar_school_2024,article,"Seminar, Francesco Busolin IR and Seminar, Franco Maria Nardini IR and Seminar, Clemencia Siro IR",1,0,nan,nan,nan,nan,nan,nan,nan,nan,nan,nan,nan,School of {Computing} {Science},nan,nan,2024.0
sengupta_determining_2023,inproceedings,"Sengupta, S. and Loomba, J. and Sharma, S. and Chapman, S.A. and Brown, D.E.",0,1,nan,nan,10.1109/ICMLA58977.2023.00066,nan,nan,nan,nan,nan,430--436,nan,nan,Determining {Risk} {Factors} for {Long} {COVID} {Using} {Positive} {Unlabeled} {Learning} on {Electronic} {Health} {Records} {Data} from {NIH} {N3C},https://www.scopus.com/inward/record.uri?eid=2-s2.0-85190109661&doi=10.1109%2fICMLA58977.2023.00066&partnerID=40&md5=cde8dd1e1ebfc5cf2cf462b058ce162d,nan,2023.0
shae_transform_2018,inproceedings,"Shae, Z. and Tsai, J.J.P.",0,1,nan,nan,10.1109/ICDCS.2018.00129,nan,nan,nan,nan,nan,1290--1299,nan,nan,Transform blockchain into distributed parallel computing architecture for precision medicine,https://www.scopus.com/inward/record.uri?eid=2-s2.0-85050990504&doi=10.1109%2fICDCS.2018.00129&partnerID=40&md5=f42e9d811c0ad7eb1b405eb878e0a8ba,2018-July,2018.0
shah_maintaining_2021,inproceedings,"Shah, U. and Dave, I. and Malde, J. and Mehta, J. and Kodeboyina, S.",0,1,nan,nan,10.1109/I2CT51068.2021.9417997,nan,nan,nan,nan,nan,nan,nan,nan,"Maintaining {Privacy} in {Medical} {Imaging} with {Federated} {Learning}, {Deep} {Learning}, {Differential} {Privacy}, and {Encrypted} {Computation}",https://www.scopus.com/inward/record.uri?eid=2-s2.0-85106511501&doi=10.1109%2fI2CT51068.2021.9417997&partnerID=40&md5=d33472d56091337c2a3e99348435c1db,nan,2021.0
shahab_large_2024,article,"Shahab, Omer and El Kurdi, Bara and Shaukat, Aasma and Nadkarni, Girish and Soroush, Ali",1,0,nan,nan,nan,nan,1756-2848,Therapeutic Advances in Gastroenterology,"Publisher: SAGE Publications Sage UK: London, England",nan,17562848241227031,nan,nan,Large language models: a primer and gastroenterology applications,nan,17,2024.0
shaikh_towards_2021,article,"Shaikh, Sarang and Daudpota, Sher Muhammad and Imran, Ali Shariq and Kastrati, Zenun",1,0,nan,nan,nan,nan,2076-3417,Applied Sciences,Publisher: MDPI,2,869,nan,nan,Towards improved classification accuracy on highly imbalanced text dataset using deep neural language models,nan,11,2021.0
shang_gamenet_2019,inproceedings,"Shang, J. and Xiao, C. and Ma, T. and Li, H. and Sun, J.",0,1,nan,nan,nan,nan,nan,nan,nan,nan,1126--1133,nan,nan,{GAMENet}: {Graph} augmented memory networks for recommending medication combination,https://www.scopus.com/inward/record.uri?eid=2-s2.0-85081397082&partnerID=40&md5=fd7042d9156f546c6836432641eeb47b,nan,2019.0
shang_pre-training_2019,inproceedings,"Shang, J. and Ma, T. and Xiao, C. and Sun, J.",0,1,nan,nan,10.24963/ijcai.2019/825,nan,nan,nan,nan,nan,5953--5959,nan,nan,Pre-training of graph augmented transformers for medication recommendation,https://www.scopus.com/inward/record.uri?eid=2-s2.0-85074900402&doi=10.24963%2fijcai.2019%2f825&partnerID=40&md5=a142e7568371ef790e6574d41003f6da,2019-August,2019.0
siganporia_privacy-enhanced_2023,inproceedings,"Siganporia, A. and Varia, M. and Gorimar, U. and Nanade, A.",0,1,nan,nan,10.1109/GCITC60406.2023.10426518,nan,nan,nan,nan,nan,nan,nan,nan,Privacy-{Enhanced} {Federated} {Learning} for {Rare} {Genetic} {Disorder} {Classification} with {EHR},https://www.scopus.com/inward/record.uri?eid=2-s2.0-85191707511&doi=10.1109%2fGCITC60406.2023.10426518&partnerID=40&md5=eeee61d3bd21b82464f2aa40c88538ec,nan,2023.0
silva_modelling_2022,article,"Silva, J.F. and Matos, S.",0,1,nan,nan,10.1016/j.jbi.2022.104195,nan,nan,Journal of Biomedical Informatics,nan,nan,nan,nan,nan,Modelling patient trajectories using multimodal information,https://www.scopus.com/inward/record.uri?eid=2-s2.0-85138488865&doi=10.1016%2fj.jbi.2022.104195&partnerID=40&md5=58a93e378a128cdf157b08ecf33e7101,134,2022.0
singh_comprehensive_2024,inproceedings,"Singh, Y. and Jaiswal, S. and Kumar, V.",0,1,nan,nan,10.1109/ICDT61202.2024.10489013,nan,nan,nan,nan,nan,220--224,nan,nan,"A {Comprehensive} {Literature} {Review} on {Privacy}, {Security}, and {Data} {Management} in {Healthcare}",https://www.scopus.com/inward/record.uri?eid=2-s2.0-85191257529&doi=10.1109%2fICDT61202.2024.10489013&partnerID=40&md5=299dba9502ec4986c8a6b6a041e5b046,nan,2024.0
skrlj_compressibility_2021,inproceedings,"Skrlj, B. and Petkovic, M.",0,1,nan,nan,10.1109/ICDM51629.2021.00166,nan,nan,nan,nan,nan,1330--1335,nan,nan,Compressibility of {Distributed} {Document} {Representations},https://www.scopus.com/inward/record.uri?eid=2-s2.0-85125207352&doi=10.1109%2fICDM51629.2021.00166&partnerID=40&md5=0952ea042a4df85e2384e48a91923ee4,2021-December,2021.0
socrates_predicting_2023,article,"Socrates, V. and Gilson, A. and Lopez, K. and Chi, L. and Taylor, R.A. and Chartash, D.",0,1,nan,nan,10.1016/j.jbi.2023.104360,nan,nan,Journal of Biomedical Informatics,nan,nan,nan,nan,nan,Predicting relations between {SOAP} note sections: {The} value of incorporating a clinical information model,https://www.scopus.com/inward/record.uri?eid=2-s2.0-85152615536&doi=10.1016%2fj.jbi.2023.104360&partnerID=40&md5=0f97778117f11c7f241eb866c425ce2b,141,2023.0
song_llm-based_2024,article,"Song, Yiping and Zhang, Juhua and Tian, Zhiliang and Yang, Yuxin and Huang, Minlie and Li, Dongsheng",1,0,nan,nan,nan,nan,nan,arXiv preprint arXiv:2402.16515,nan,nan,nan,nan,nan,{LLM}-based {Privacy} {Data} {Augmentation} {Guided} by {Knowledge} {Distillation} with a {Distribution} {Tutor} for {Medical} {Text} {Classification},nan,nan,2024.0
