ID,ENTRYTYPE,author,bib-gs_bronze_gquerya,bib-scopus_bronze_querya,bib_id,booktitle,doi,isbn,issn,journal,note,number,pages,publisher,shorttitle,title,url,volume,year
lu_entity_2024,article,"Lu, X. and Tong, J. and Xia, S.",0,1,nan,nan,10.3934/mbe.2024058,nan,nan,Mathematical Biosciences and Engineering,nan,1,1342--1355,nan,nan,Entity relationship extraction from {Chinese} electronic medical records based on feature augmentation and cascade binary tagging framework,https://www.scopus.com/inward/record.uri?eid=2-s2.0-85181439495&doi=10.3934%2fmbe.2024058&partnerID=40&md5=615800801ee9e9f320601763352d5703,21,2024.0
lu_multi-label_2024,article,"Lu, C. and Reddy, C.K. and Wang, P. and Nie, D. and Ning, Y.",0,1,nan,nan,10.1109/TKDE.2023.3310909,nan,nan,IEEE Transactions on Knowledge and Data Engineering,nan,4,1728--1740,nan,nan,Multi-{Label} {Clinical} {Time}-{Series} {Generation} via {Conditional} {GAN},https://www.scopus.com/inward/record.uri?eid=2-s2.0-85170532776&doi=10.1109%2fTKDE.2023.3310909&partnerID=40&md5=11742f0dd2a93769b3840829152ca660,36,2024.0
lu_textual_2021,inproceedings,"Lu, Q. and Dou, D. and Nguyen, T.H.",0,1,nan,nan,10.1109/BIBM52615.2021.9669861,nan,nan,nan,nan,nan,2817--2821,nan,nan,Textual {Data} {Augmentation} for {Patient} {Outcomes} {Prediction},https://www.scopus.com/inward/record.uri?eid=2-s2.0-85125173639&doi=10.1109%2fBIBM52615.2021.9669861&partnerID=40&md5=8f65381a61dfd80c8ea07cf229b95b20,nan,2021.0
luo_hitanet_2020,inproceedings,"Luo, J. and Ye, M. and Xiao, C. and Ma, F.",0,1,nan,nan,10.1145/3394486.3403107,nan,nan,nan,nan,nan,647--656,nan,nan,{HiTANet}: {Hierarchical} {Time}-{Aware} {Attention} {Networks} for {Risk} {Prediction} on {Electronic} {Health} {Records},https://www.scopus.com/inward/record.uri?eid=2-s2.0-85090413454&doi=10.1145%2f3394486.3403107&partnerID=40&md5=285f67478f27bf10224f252cff2cd4e2,nan,2020.0
lybarger_leveraging_2023,article,"Lybarger, K. and Dobbins, N.J. and Long, R. and Singh, A. and Wedgeworth, P. and Uzuner, Ö. and Yetisgen, M.",0,1,nan,nan,10.1093/jamia/ocad073,nan,nan,Journal of the American Medical Informatics Association : JAMIA,nan,8,1389--1397,nan,nan,Leveraging natural language processing to augment structured social determinants of health data in the electronic health record,https://www.scopus.com/inward/record.uri?eid=2-s2.0-85164158409&doi=10.1093%2fjamia%2focad073&partnerID=40&md5=cb951d1930aed4d4965c3bfd2b233003,30,2023.0
magudia_utility_2023,article,"Magudia, K. and Bridge, C.P. and Bay, C.P. and Farah, S. and Babic, A. and Fintelmann, F.J. and Brais, L.K. and Andriole, K.P. and Wolpin, B.M. and Rosenthal, M.H.",0,1,nan,nan,10.2214/AJR.22.27977,nan,nan,American Journal of Roentgenology,nan,2,236--244,nan,nan,"Utility of {Normalized} {Body} {Composition} {Areas}, {Derived} from {Outpatient} {Abdominal} {CT} {Using} a {Fully} {Automated} {Deep} {Learning} {Method}, for {Predicting} {Subsequent} {Cardiovascular} {Events}",https://www.scopus.com/inward/record.uri?eid=2-s2.0-85147046100&doi=10.2214%2fAJR.22.27977&partnerID=40&md5=b8c98d8efc4f231c481832630418e1df,220,2023.0
maleki_varnosfaderani_role_2024,article,"Maleki Varnosfaderani, Shiva and Forouzanfar, Mohamad",1,0,nan,nan,nan,nan,2306-5354,Bioengineering,Publisher: MDPI,4,337,nan,nan,The role of {AI} in hospitals and clinics: transforming healthcare in the 21st century,nan,11,2024.0
mallikarjuna_blockchain_2022,article,"Mallikarjuna, B. and Shrivastava, G. and Sharma, M.",0,1,nan,nan,10.1111/exsy.12778,nan,nan,Expert Systems,nan,3,nan,nan,nan,Blockchain technology: {A} {DNN} token-based approach in healthcare and {COVID}-19 to generate extracted data,https://www.scopus.com/inward/record.uri?eid=2-s2.0-85110933404&doi=10.1111%2fexsy.12778&partnerID=40&md5=8366e6aff136cdf8bb5f5316753f0776,39,2022.0
mantey_integrated_2022,article,"Mantey, E.A. and Zhou, C. and Srividhya, S.R. and Jain, S.K. and Sundaravadivazhagan, B.",0,1,nan,nan,10.3389/fpubh.2022.905265,nan,nan,Frontiers in Public Health,nan,nan,nan,nan,nan,Integrated {Blockchain}-{Deep} {Learning} {Approach} for {Analyzing} the {Electronic} {Health} {Records} {Recommender} {System},https://www.scopus.com/inward/record.uri?eid=2-s2.0-85130716515&doi=10.3389%2ffpubh.2022.905265&partnerID=40&md5=55e5afe61dd2e2fb1b9b9945d7b7b286,10,2022.0
manzanares-salor_automatic_2022,inproceedings,"Manzanares-Salor, Benet and Sánchez, David and Lison, Pierre",1,0,nan,nan,nan,nan,nan,nan,nan,nan,157--171,Springer,nan,Automatic evaluation of disclosure risks of text anonymization methods,nan,nan,2022.0
marey_applications_2024,article,"Marey, Ahmed and Serdysnki, Kevin Christopher and Killeen, Benjamin D and Unberath, Mathias and Umair, Muhammad",1,0,nan,nan,nan,nan,nan,BJR{\textbar} Artificial Intelligence,Publisher: Oxford Academic,1,nan,nan,nan,Applications and implementation of generative artificial intelligence in cardiovascular imaging with a focus on ethical and legal considerations: what cardiovascular imagers need to know!,nan,1,2024.0
marichamy_blockchain_2023,article,"Marichamy, V.S. and Natarajan, V.",0,1,nan,nan,10.1016/j.datak.2022.102122,nan,nan,Data and Knowledge Engineering,nan,nan,nan,nan,nan,Blockchain based {Securing} {Medical} {Records} in {Big} {Data} {Analytics},https://www.scopus.com/inward/record.uri?eid=2-s2.0-85144569692&doi=10.1016%2fj.datak.2022.102122&partnerID=40&md5=9cfda405aa7459ae9cfed6b9f9a73f83,144,2023.0
marimon_automatic_2019,inproceedings,"Marimon, M. and Gonzalez-Agirre, A. and Intxaurrondo, A. and Rodríguez, H. and Martin, J.A.L. and Villegas, M. and Krallinger, M.",0,1,nan,nan,nan,nan,nan,nan,nan,nan,618--638,nan,nan,"Automatic de-identification of medical texts in {Spanish}: {The} {Meddocan} track, corpus, guidelines, methods and evaluation of results",https://www.scopus.com/inward/record.uri?eid=2-s2.0-85071166580&partnerID=40&md5=fb4f9890cfb089147378e28c1963a721,2421,2019.0
marques_ai_2024,book,"Marques, Oge",1,0,nan,nan,nan,1-00-383644-5,nan,nan,nan,nan,nan,CRC Press,nan,{AI} for {Radiology},nan,nan,2024.0
martenot_lisa_2022,article,"Martenot, V. and Masdeu, V. and Cupe, J. and Gehin, F. and Blanchon, M. and Dauriat, J. and Horst, A. and Renaudin, M. and Girard, P. and Zucker, J.-D.",0,1,nan,nan,10.1186/s12911-022-02085-0,nan,nan,BMC Medical Informatics and Decision Making,nan,1,nan,nan,nan,{LiSA}: an assisted literature search pipeline for detecting serious adverse drug events with deep learning,https://www.scopus.com/inward/record.uri?eid=2-s2.0-85144501720&doi=10.1186%2fs12911-022-02085-0&partnerID=40&md5=30fd6602f53c7fde462403c0ee4fd5b6,22,2022.0
masud_deep-adca_2022,article,"Masud, J.H.B. and Shun, C. and Kuo, C.-C. and Islam, M.M. and Yeh, C.-Y. and Yang, H.-C. and Lin, M.-C.",0,1,nan,nan,10.3390/jpm12050707,nan,nan,Journal of Personalized Medicine,nan,5,nan,nan,nan,Deep-{ADCA}: {Development} and {Validation} of {Deep} {Learning} {Model} for {Automated} {Diagnosis} {Code} {Assignment} {Using} {Clinical} {Notes} in {Electronic} {Medical} {Records},https://www.scopus.com/inward/record.uri?eid=2-s2.0-85129804254&doi=10.3390%2fjpm12050707&partnerID=40&md5=4cd6afa17507073a19c49e82052a8f26,12,2022.0
mathkor_multirole_2024,article,"Mathkor, Darin Mansor and Mathkor, Noof and Bassfar, Zaid and Bantun, Farkad and Slama, Petr and Ahmad, Faraz and Haque, Shafiul",1,0,nan,nan,nan,nan,1876-0341,Journal of Infection and Public Health,Publisher: Elsevier,nan,nan,nan,nan,Multirole of the {Internet} of {Medical} {Things} ({IoMT}) in {Biomedical} {Systems} for {Managing} {Smart} {Healthcare} {Systems}: {An} {Overview} of {Current} and {Future} {Innovative} {Trends},nan,nan,2024.0
meng_empirical_2022,article,"Meng, L. and Zhao, M. and Cui, Z. and Zhang, X. and Zhong, S.",0,1,nan,nan,10.1016/j.compind.2021.103557,nan,nan,Computers in Industry,nan,nan,nan,nan,nan,Empirical mode reconstruction: {Preserving} intrinsic components in data augmentation for intelligent fault diagnosis of civil aviation hydraulic pumps,https://www.scopus.com/inward/record.uri?eid=2-s2.0-85118483055&doi=10.1016%2fj.compind.2021.103557&partnerID=40&md5=a75b5ce7e8a8c1422e97522209a72e0b,134,2022.0
minot_interpretable_2022,article,"Minot, J.R. and Cheney, N. and Maier, M. and Elbers, D.C. and Danforth, C.M. and Dodds, P.S.",0,1,nan,nan,10.1145/3524887,nan,nan,ACM Transactions on Computing for Healthcare,nan,4,nan,nan,nan,Interpretable {Bias} {Mitigation} for {Textual} {Data}: {Reducing} {Genderization} in {Patient} {Notes} {While} {Maintaining} {Classification} {Performance},https://www.scopus.com/inward/record.uri?eid=2-s2.0-85140732696&doi=10.1145%2f3524887&partnerID=40&md5=7ab3833e79cbb425264751f8b25f60c0,3,2022.0
miranda_deepbiomarker_2022,article,"Miranda, O. and Fan, P. and Qi, X. and Yu, Z. and Ying, J. and Wang, H. and Brent, D.A. and Silverstein, J.C. and Chen, Y. and Wang, L.",0,1,nan,nan,10.3390/jpm12040524,nan,nan,Journal of Personalized Medicine,nan,4,nan,nan,nan,{DeepBiomarker}: {Identifying} {Important} {Lab} {Tests} from {Electronic} {Medical} {Records} for the {Prediction} of {Suicide}-{Related} {Events} among {PTSD} {Patients},https://www.scopus.com/inward/record.uri?eid=2-s2.0-85127658848&doi=10.3390%2fjpm12040524&partnerID=40&md5=0cf96c61a113e71e2101a6bc69194eae,12,2022.0
mitchell_question-and-answer_2022,article,"Mitchell, Joseph Ross and Szepietowski, Phillip and Howard, Rachel and Reisman, Phillip and Jones, Jennie D and Lewis, Patricia and Fridley, Brooke L and Rollison, Dana E",1,0,nan,nan,nan,nan,1438-8871,Journal of medical internet research,"Publisher: JMIR Publications Toronto, Canada",3,e27210,nan,nan,A question-and-answer system to extract data from free-text oncological pathology reports ({CancerBERT} network): development study,nan,24,2022.0
mitra_synth-sbdh_2024,article,"Mitra, Avijit and Druhl, Emily and Goodwin, Raelene and Yu, Hong",1,0,nan,nan,nan,nan,nan,arXiv preprint arXiv:2406.06056,nan,nan,nan,nan,nan,Synth-{SBDH}: {A} {Synthetic} {Dataset} of {Social} and {Behavioral} {Determinants} of {Health} for {Clinical} {Text},nan,nan,2024.0
moen_clustering_2022,inproceedings,"Moen, H. and Suhonen, H. and Salanterä, S. and Salakoski, T. and Peltonen, L.-M.",0,1,nan,nan,10.3233/SHTI220606,nan,nan,nan,nan,nan,854--858,nan,nan,Clustering {Nursing} {Sentences}-{Comparing} {Three} {Sentence} {Embedding} {Methods},https://www.scopus.com/inward/record.uri?eid=2-s2.0-85131105789&doi=10.3233%2fSHTI220606&partnerID=40&md5=7e2de87a8e6740435d20781006955475,294,2022.0
mohammed_medical_2024,article,"Mohammed, Foziya Ahmed and Tune, Kula Kekeba and Assefa, Beakal Gizachew and Jett, Marti and Muhie, Seid",1,0,nan,nan,nan,nan,2504-4990,Machine Learning and Knowledge Extraction,Publisher: MDPI,1,699--735,nan,nan,Medical {Image} {Classifications} {Using} {Convolutional} {Neural} {Networks}: {A} {Survey} of {Current} {Methods} and {Statistical} {Modeling} of the {Literature},nan,6,2024.0
mohsen_artificial_2022,article,"Mohsen, F. and Ali, H. and El Hajj, N. and Shah, Z.",0,1,nan,nan,10.1038/s41598-022-22514-4,nan,nan,Scientific Reports,nan,1,nan,nan,nan,Artificial intelligence-based methods for fusion of electronic health records and imaging data,https://www.scopus.com/inward/record.uri?eid=2-s2.0-85140653581&doi=10.1038%2fs41598-022-22514-4&partnerID=40&md5=5902e2df13a1ae46934d0d701875f255,12,2022.0
molina_improving_2023,article,"Molina, Marco and Jiménez, Cristina and Montenegro, Carlos",1,0,nan,nan,nan,nan,1999-4923,Pharmaceutics,Publisher: MDPI,7,1823,nan,nan,Improving {Drug}–{Drug} {Interaction} {Extraction} with {Gaussian} {Noise},nan,15,2023.0
molinet_explanatory_2024,article,"Molinet, Benjamin and Marro, Santiago and Cabrio, Elena and Villata, Serena",1,0,nan,nan,nan,nan,2041-1480,Journal of Biomedical Semantics,Publisher: Springer,1,8,nan,nan,Explanatory argumentation in natural language for correct and incorrect medical diagnoses,nan,15,2024.0
moodley_artificial_2024,article,"Moodley, K.",0,1,nan,nan,10.7196/SAMJ.2024.v114i2.1631,nan,nan,South African Medical Journal,nan,1,16--20,nan,nan,Artificial intelligence ({AI}) or augmented intelligence? {How} big data and {AI} are transforming healthcare: {Challenges} and opportunities,https://www.scopus.com/inward/record.uri?eid=2-s2.0-85187790252&doi=10.7196%2fSAMJ.2024.v114i2.1631&partnerID=40&md5=c734d9923507e868e265b7679a2420d6,114,2024.0
muaad_deep_2024,article,"Muaad, Abdullah Y and Davanagere, Hanumanthappa Jayappa and Hussain, Jamil and Al-antari, Mugahed A",1,0,nan,nan,nan,nan,1573-7721,Multimedia Tools and Applications,Publisher: Springer,nan,1--39,nan,nan,Deep ensemble transfer learning framework for {COVID}-19 {Arabic} text identification via deep active learning and text data augmentation,nan,nan,2024.0
mugisha_bridging_2023,article,"Mugisha, Chérubin and Paik, Incheon",1,0,nan,nan,nan,nan,2079-9292,Electronics,Publisher: MDPI,8,1848,nan,nan,Bridging the {Gap} between {Medical} {Tabular} {Data} and {NLP} {Predictive} {Models}: {A} {Fuzzy}-{Logic}-{Based} {Textualization} {Approach},nan,12,2023.0
nagoor_covid_icu_bert_2023,article,"Nagoor, Shahad and Hederman, Lucy and Koidl, Kevin and Caputo, Annalina",1,0,nan,nan,nan,nan,nan,International Journal of Cognitive and Language Sciences,nan,8,445--452,nan,nan,{COVID}\_ICU\_BERT: {A} {Fine}-tuned {Language} {Model} for {COVID}-19 {Intensive} {Care} {Unit} {Clinical} {Notes},nan,17,2023.0
nahed_recommendation_2023,inproceedings,"Nahed, P. and Kambar, M.E.Z.N. and Cacho, J.R.F. and Lee, G. and Cummings, J. and Taghva, K.",0,1,nan,nan,10.1007/978-981-19-7660-5_6,nan,nan,nan,nan,nan,63--73,nan,nan,A {Recommendation} {Model} for {Predicting} {Alzheimer}’s {Drugs}’ {Mechanism} of {Action},https://www.scopus.com/inward/record.uri?eid=2-s2.0-85147986341&doi=10.1007%2f978-981-19-7660-5_6&partnerID=40&md5=999e9aff504d8c5b5d3481e51593a341,578,2023.0
naous_reducing_nodate,article,"Naousπ, Yao Douπ Isadora Krseke Tarek and Kabrae, Anubha and Xuπ, Sauvik Dase Alan Ritterπ Wei",1,0,nan,nan,nan,nan,nan,nan,nan,nan,nan,nan,nan,Reducing {Privacy} {Risks} in {Online} {Self}-{Disclosure} with {Language} {Models},nan,nan,nan
naseer_scoehr_2023,inproceedings,"Naseer, A.A. and Walker, B. and Landon, C. and Ambrosy, A. and Fudim, M. and Wysham, N. and Toro, B. and Swaminathan, S. and Lyons, T.",0,1,nan,nan,nan,nan,nan,nan,nan,nan,489--508,nan,nan,{ScoEHR}: {Generating} {Synthetic} {Electronic} {Health} {Records} using {Continuous}-time {Diffusion} {Models},https://www.scopus.com/inward/record.uri?eid=2-s2.0-85184280486&partnerID=40&md5=0eebe66c3e958ab1fa1f8caf1431e060,219,2023.0
nassiri_recent_2024,article,"Nassiri, Khalid and Akhloufi, Moulay A",1,0,nan,nan,nan,nan,2673-7426,BioMedInformatics,Publisher: MDPI,2,1097--1143,nan,nan,Recent {Advances} in {Large} {Language} {Models} for {Healthcare},nan,4,2024.0
neel_privacy_2023,article,"Neel, Seth and Chang, Peter",1,0,nan,nan,nan,nan,nan,arXiv preprint arXiv:2312.06717,nan,nan,nan,nan,nan,Privacy issues in large language models: {A} survey,nan,nan,2023.0
nerella_transformers_2023,article,"Nerella, Subhash and Bandyopadhyay, Sabyasachi and Zhang, Jiaqing and Contreras, Miguel and Siegel, Scott and Bumin, Aysegul and Silva, Brandon and Sena, Jessica and Shickel, Benjamin and Bihorac, Azra",1,0,nan,nan,nan,nan,nan,arXiv preprint arXiv:2307.00067,nan,nan,nan,nan,nan,Transformers in healthcare: {A} survey,nan,nan,2023.0
newby_optimising_2024,article,"Newby, Danielle and Taylor, Niall and Joyce, Dan W and Winchester, Laura M",1,0,nan,nan,nan,nan,2158-3188,Translational Psychiatry,Publisher: Nature Publishing Group UK London,1,232,nan,nan,Optimising the use of electronic medical records for large scale research in psychiatry,nan,14,2024.0
newman-griffis_ambiguity_2021,article,"Newman-Griffis, D. and Divita, G. and Desmet, B. and Zirikly, A. and Rosé, C.P. and Fosler-Lussier, E.",0,1,nan,nan,10.1093/jamia/ocaa269,nan,nan,Journal of the American Medical Informatics Association,nan,3,516--532,nan,nan,Ambiguity in medical concept normalization: {An} analysis of types and coverage in electronic health record datasets,https://www.scopus.com/inward/record.uri?eid=2-s2.0-85102658038&doi=10.1093%2fjamia%2focaa269&partnerID=40&md5=17c667a637ec4681bf00f45205a628e6,28,2021.0
nguyen_hybrid_2023,article,"Nguyen, K.-A.-N. and Tandon, P. and Ghanavati, S. and Cheetirala, S.N. and Timsina, P. and Freeman, R. and Reich, D. and Levin, M.A. and Mazumdar, M. and Fayad, Z.A. and Kia, A.",0,1,nan,nan,10.2196/46905,nan,nan,JMIR Formative Research,nan,1,nan,nan,nan,A {Hybrid} {Decision} {Tree} and {Deep} {Learning} {Approach} {Combining} {Medical} {Imaging} and {Electronic} {Medical} {Records} to {Predict} {Intubation} {Among} {Hospitalized} {Patients} {With} {COVID}-19: {Algorithm} {Development} and {Validation},https://www.scopus.com/inward/record.uri?eid=2-s2.0-85177448479&doi=10.2196%2f46905&partnerID=40&md5=0b29830ce51f70de086a50cdf51b0d18,7,2023.0
nguyen_predicting_2019,article,"Nguyen, B.P. and Pham, H.N. and Tran, H. and Nghiem, N. and Nguyen, Q.H. and Do, T.T.T. and Tran, C.T. and Simpson, C.R.",0,1,nan,nan,10.1016/j.cmpb.2019.105055,nan,nan,Computer Methods and Programs in Biomedicine,nan,nan,nan,nan,nan,Predicting the onset of type 2 diabetes using wide and deep learning with electronic health records,https://www.scopus.com/inward/record.uri?eid=2-s2.0-85071856686&doi=10.1016%2fj.cmpb.2019.105055&partnerID=40&md5=08d6d89489b54e6a049e9b792f09c6ec,182,2019.0
nielbo_quantitative_2024,article,"Nielbo, Kristoffer L and Karsdorp, Folgert and Wevers, Melvin and Lassche, Alie and Baglini, Rebekah B and Kestemont, Mike and Tahmasebi, Nina",1,0,nan,nan,nan,nan,2662-8449,Nature Reviews Methods Primers,Publisher: Nature Publishing Group UK London,1,25,nan,nan,Quantitative text analysis,nan,4,2024.0
nievas_distilling_2024,article,"Nievas, Mauro and Basu, Aditya and Wang, Yanshan and Singh, Hrituraj",1,0,nan,nan,nan,nan,1067-5027,Journal of the American Medical Informatics Association,Publisher: Oxford University Press,nan,ocae073,nan,nan,Distilling large language models for matching patients to clinical trials,nan,nan,2024.0
niklaus_flawn-t5_2024,article,"Niklaus, Joel and Zheng, Lucia and McCarthy, Arya D and Hahn, Christopher and Rosen, Brian M and Henderson, Peter and Ho, Daniel E and Honke, Garrett and Liang, Percy and Manning, Christopher",1,0,nan,nan,nan,nan,nan,arXiv preprint arXiv:2404.02127,nan,nan,nan,nan,nan,{FLawN}-{T5}: {An} {Empirical} {Examination} of {Effective} {Instruction}-{Tuning} {Data} {Mixtures} for {Legal} {Reasoning},nan,nan,2024.0
nogues_weakly_2022,article,"Nogues, I.-E. and Wen, J. and Lin, Y. and Liu, M. and Tedeschi, S.K. and Geva, A. and Cai, T. and Hong, C.",0,1,nan,nan,10.1016/j.jbi.2022.104175,nan,nan,Journal of Biomedical Informatics,nan,nan,nan,nan,nan,Weakly {Semi}-supervised phenotyping using {Electronic} {Health} records,https://www.scopus.com/inward/record.uri?eid=2-s2.0-85138475699&doi=10.1016%2fj.jbi.2022.104175&partnerID=40&md5=5c2c8e75d49b9d120023d882af956207,134,2022.0
novel_knowledge_nodate,article,"NOVEL, GAINING",1,0,nan,nan,nan,nan,nan,nan,nan,nan,nan,nan,nan,{KNOWLEDGE} {DISCOVERY} {FROM} {PATIENT} {FORUMS},nan,nan,nan
novelli_generative_2024,article,"Novelli, Claudio and Casolari, Federico and Hacker, Philipp and Spedicato, Giorgio and Floridi, Luciano",1,0,nan,nan,nan,nan,nan,arXiv preprint arXiv:2401.07348,nan,nan,nan,nan,nan,"Generative {AI} in {EU} {Law}: {Liability}, {Privacy}, {Intellectual} {Property}, and {Cybersecurity}",nan,nan,2024.0
nunez_predicting_2024,article,"Nunez, John-Jose and Leung, Bonnie and Ho, Cheryl and Ng, Raymond T and Bates, Alan T",1,0,nan,nan,nan,nan,2730-664X,Communications Medicine,Publisher: Nature Publishing Group UK London,1,69,nan,nan,Predicting which patients with cancer will see a psychiatrist or counsellor from their initial oncology consultation document using natural language processing,nan,4,2024.0
nwufo_secrecy_2023,inproceedings,"Nwufo, C. and Sun, Y. and Simpson, O. and Cao, P.",0,1,nan,nan,10.1109/VTC2023-Spring57618.2023.10199952,nan,nan,nan,nan,nan,nan,nan,nan,Secrecy {Energy} {Efficiency} {Maximization} in {Multi}-{RIS}-{Aided} {SWIPT} {Wireless} {Network},https://www.scopus.com/inward/record.uri?eid=2-s2.0-85169807957&doi=10.1109%2fVTC2023-Spring57618.2023.10199952&partnerID=40&md5=76800972cd357745a7881d83b2e83600,2023-June,2023.0
obaid_advanced_2023,book,"Obaid, Ahmed J and Bhushan, Bharat and Rajest, S Suman",1,0,nan,nan,nan,9798369305041,nan,nan,nan,nan,nan,IGI Global,nan,Advanced {Applications} of {Generative} {AI} and {Natural} {Language} {Processing} {Models},nan,nan,2023.0
obeid_impact_2019,inproceedings,"Obeid, J.S. and Heider, P.M. and Weeda, E.R. and Matuskowitz, A.J. and Carr, C.M. and Gagnon, K. and Crawford, T. and Meystre, S.M.",0,1,nan,nan,10.3233/SHTI190228,nan,nan,nan,nan,nan,283--287,nan,nan,Impact of de-identification on clinical text classification using traditional and deep learning classifiers,https://www.scopus.com/inward/record.uri?eid=2-s2.0-85071485769&doi=10.3233%2fSHTI190228&partnerID=40&md5=ad1b2c229565590b15a8cd67e8b8fb44,264,2019.0
oh_membership_2022,inproceedings,"Oh, Myung Gyo and Park, Leo Hyun and Kim, Jaeuk and Park, Jaewoo and Kwon, Taekyoung",1,0,nan,nan,nan,nan,nan,nan,nan,nan,143--155,Springer,nan,On {Membership} {Inference} {Attacks} to {Generative} {Language} {Models} {Across} {Language} {Domains},nan,nan,2022.0
om_kumar_ehr_2023,article,"Om Kumar, C.U. and Gajendran, S. and Bhavadharini, R.M. and Suguna, M. and Krithiga, R.",0,1,nan,nan,10.1016/j.knosys.2023.110638,nan,nan,Knowledge-Based Systems,nan,nan,nan,nan,nan,{EHR} privacy preservation using federated learning with {DQRE}-{Scnet} for healthcare application domains,https://www.scopus.com/inward/record.uri?eid=2-s2.0-85163054127&doi=10.1016%2fj.knosys.2023.110638&partnerID=40&md5=9816ab913038bd80844915066ecff9e0,275,2023.0
ong_diagnostic_2023,article,"Ong, Z.Z. and Sadek, Y. and Liu, X. and Qureshi, R. and Liu, S.-H. and Li, T. and Sounderajah, V. and Ashrafian, H. and Ting, D.S.W. and Said, D.G. and Mehta, J.S. and Burton, M.J. and Dua, H.S. and Ting, D.S.J.",0,1,nan,nan,10.1136/bmjopen-2022-065537,nan,nan,BMJ Open,nan,5,nan,nan,nan,Diagnostic performance of deep learning in infectious keratitis: {A} systematic review and meta-analysis protocol,https://www.scopus.com/inward/record.uri?eid=2-s2.0-85158866429&doi=10.1136%2fbmjopen-2022-065537&partnerID=40&md5=95960a61dfab5092189bd139ed073dd1,13,2023.0
ormerod_predicting_2021,article,"Ormerod, M. and del Rincón, J.M. and Devereux, B.",0,1,nan,nan,10.2196/23099,nan,nan,JMIR Medical Informatics,nan,5,nan,nan,nan,Predicting semantic similarity between clinical sentence pairs using transformer models: {Evaluation} and representational analysis,https://www.scopus.com/inward/record.uri?eid=2-s2.0-85106949779&doi=10.2196%2f23099&partnerID=40&md5=65365efa2acbb29429798bd919851ea0,9,2021.0
oubenali_visualization_2022,article,"Oubenali, N. and Messaoud, S. and Filiot, A. and Lamer, A. and Andrey, P.",0,1,nan,nan,10.1186/s12911-022-01822-9,nan,nan,BMC Medical Informatics and Decision Making,nan,1,nan,nan,nan,Visualization of medical concepts represented using word embeddings: a scoping review,https://www.scopus.com/inward/record.uri?eid=2-s2.0-85127298072&doi=10.1186%2fs12911-022-01822-9&partnerID=40&md5=4a2181b37f1f896feaa2bc326147a72f,22,2022.0
pal_futuristic_2024,article,"Pal, P. and Kumar, A. and Saini, G.",0,1,nan,nan,10.32629/jai.v7i1.743,nan,nan,Journal of Autonomous Intelligence,nan,1,nan,nan,nan,"Futuristic frontiers in science and technology: {Advancements}, requirements, and challenges of multi-approach research",https://www.scopus.com/inward/record.uri?eid=2-s2.0-85174148843&doi=10.32629%2fjai.v7i1.743&partnerID=40&md5=f164ae56ab62c9e39fe16a51ae0f3058,7,2024.0
papadopoulou_automated_2024,article,"Papadopoulou, Anthi",1,0,nan,nan,nan,nan,nan,nan,nan,nan,nan,nan,nan,"Automated {Text} {Sanitization} {Beyond} {Named} {Entities}: {Resources}, {Methods}, {Evaluation}",nan,nan,2024.0
park_feasibility_2022,article,"Park, J.H. and Park, I. and Han, K. and Yoon, J. and Sim, Y. and Kim, S.J. and Won, J.Y. and Lee, S. and Kwon, J.H. and Moon, S. and Kim, G.M. and Kim, M.-D.",0,1,nan,nan,10.3348/kjr.2022.0364,nan,nan,Korean Journal of Radiology,nan,10,949--958,nan,nan,Feasibility of {Deep} {Learning}-{Based} {Analysis} of {Auscultation} for {Screening} {Significant} {Stenosis} of {Native} {Arteriovenous} {Fistula} for {Hemodialysis} {Requiring} {Angioplasty},https://www.scopus.com/inward/record.uri?eid=2-s2.0-85138988177&doi=10.3348%2fkjr.2022.0364&partnerID=40&md5=e8ad22bb32d648dc6a89df72ff29b9b0,23,2022.0
park_leveraging_2024,article,"Park, Chaelim and Lee, Hayoung and Jeong, Okran",1,0,nan,nan,nan,nan,nan,nan,Publisher: Preprints,nan,nan,nan,nan,Leveraging {Medical} {Knowledge} {Graphs} and {Large} {Language} {Models} for {Enhanced} {Mental} {Disorder} {Information} {Extraction},nan,nan,2024.0
parreco_comparing_2019,article,"Parreco, J. and Soe-Lin, H. and Parks, J.J. and Byerly, S. and Chatoor, M. and Buicko, J.L. and Namias, N. and Rattan, R.",0,1,nan,nan,nan,nan,nan,American Surgeon,nan,7,725--729,nan,nan,Comparing machine learning algorithms for predicting acute kidney injury,https://www.scopus.com/inward/record.uri?eid=2-s2.0-85071282243&partnerID=40&md5=741755d0857fd04dc8df6ec8d04a8662,85,2019.0
pattisapu_distant_2020,article,"Pattisapu, N. and Anand, V. and Patil, S. and Palshikar, G. and Varma, V.",0,1,nan,nan,10.1016/j.jbi.2020.103522,nan,nan,Journal of Biomedical Informatics,nan,nan,nan,nan,nan,Distant supervision for medical concept normalization,https://www.scopus.com/inward/record.uri?eid=2-s2.0-85089262326&doi=10.1016%2fj.jbi.2020.103522&partnerID=40&md5=93464b574ba44d015381fa2fa3469566,109,2020.0
